,dialogue_id,Q-3,Q-2,Q-1,A
1299010,MDRW2100010933.1,미국에서 인턴을 했어서 캐나다로 여행다녀왔어요 나이아가라 폭포도 보고 몬트리올 도시다서 단풍 구경도 했어요 몬트리올은 프랑스어를 주로 써서 캐나다 내에서도 더 이국적이더라구요,아 캐나다에서 프랑스어도 쓰는군요 재밌었을 것 같아요 저도 나중에 캐나다 가보고 싶어요,캐나다 동부쪽 몬트리올 퀘백 이쪽은 프랑스어 쓰더러구요 프랑스에서 이민을 많이 왔나봐요 나중에 한번 가볼만 한거같아요 고고님은 기억에 남는 여행지 있으신가요?,저는 수학여행으로 제주도 갔던게 기억에 많이 남네요 그때 사진을 많이 찍었는데 사진만 보면 그때 분위기가 생각나요
116074,HuLiC1904,나도 먹는걸 좋아해. 너랑 이렇게 노는게 일이야 ㅋㅋㅋ,저도 먹는 걸 좋아해요. 당신이 가장 좋아하는 음식의 종류는 무엇입니까? 저는 이탈리아어를 좋아해요.,이탈리아 음식을 좋아한다는거지?,"네, 저는 이탈리아 요리를 좋아해요. 좋아하는 음식이 있나요?"
1362235,MDRW2100015326.1,무화과 마카롱도 맛있는데 잘 안 팔더라,그건 못 들어봤어,마카롱 안에 무화과를 넣은 거야,그건 아는데 잘 없던데
1827270,﻿MDRW2100046985.155,,,그 배우,엉
1854685,MDRW2100047023.1,이상한데,ㅌㅋㅋㅋㅋ그치,응,수건 안쓰고
43014,Chat3940,양이 많고 가짓수도 많잖아.,음식들이 대체로 맛이 없어.,아마 계속 음식을 데워 대서 그럴꺼야.,양보다 질이지.
137116,HuLiC239,저는 태평양의 일부인 주안섬에 가보고 싶습니다.,주안섬은 첨 들어보네. 거기는 머가 유명해?,카리브해에서 가장 큰 섬 체인입니다. 매우 아름답습니다.,해변이 아름다운 곳인가? 주안섬은 어느나라에 있는 섬이야?
435995,HuLiC9288,흠 삼겹살?,헐 맛있겠다 ㅋㅋ 나도 먹어야지 ㅋㅋㅋ,ㅋㅋㅋㅋ아 배고프당,넌 뭐해 ?ㅋㅋ
68365,﻿Chat8796,,,어제 길 가다가 이상형을 봤어.,"오, 그래서 어떻게 했는데."
539217,﻿감성대화말뭉치.27181,,,내 친구가 남자 친구가 다른 여자와 다정하게 식사하고 있는 걸 봤대. 근데 남자친구는 나한테 그런 얘길 한 적이 없어.,친구로부터 남자친구와 다른 여자와 식사하고 있었다는 얘길 전해 들어 혼란스럽겠어요.
1276039,MDRW2100009331.1,열대어 같은 ㅎㅎ,열대어 금붕어도 괜찮겠네요,네 한번 생각해보셔요,네 좋은 정보 감사해요 반려동물 키우시나요
1466316,MDRW2100022640.1,요즘 계단걷기 시작했어요,몇층정도 걸으시나요?,15층이요! 앗 name1님도 운동?!!,전 등산자주다녀요.. 15층 몇회 왕복이요?
534033,감성대화말뭉치.26164,내 나이대의 여자가 직장생활을 하려면 하루도 마음 편할 날이 없어.,힘드시군요. 어떻게 하면 지금의 상황을 변화시킬 수 있을까요?,일단 주어졌으니 일은 해내야지. 하지만 나중에는 파트타임으로 변경해야 될 것 같아.,직장동료들과 사이가 좋아지길 바랄게요.
868938,MDRW2100001390.16,ㅎㅎ백화점말고 아울렛이라도ㅋ,아울렛도 유명한덴 줄서서 들어가더라구요,아 그래요?ㅡㅡ,흥~~ 할까봐 그런덴못가고 그렇다고 mcm같은건 사기싫고 여기 몇군데 줄서더라구요
1934163,MDRW2100047087.1,응. 나 순대도 만들어먹었었어 ㅋㅋ,미국?,응,오래됫어?진짜세끼 빵먹어?
1526853,MDRW2100026716.1,그냥 대학원 때려치시는건 어떠쉰지 교수가 되고 싶으신건지...,ㅠㅠㅠㅠㅠㅠㅠㅠㅠㅠㅠㅠㅠㅠㅠㅠㅠㅠㅠㅠㅠㅠㅠㅠㅠㅠㅠㅠㅠㅠ 예술을사랑한죄지....(진짜이렇게밖엔....,근데 거기서 교수되려면 그 교수님 아래 소속으로 조교수 될텐데 재앙만이 남아있는게 아닌지,ㅠㅠㅠㅠㅠㅠㅠㅠㅠㅠㅠㅠㅠㅠㅠㅠㅠㅠㅠㅠㅠㅠ
1779661,MDRW2100044893.1,김밥 맛있다고 했어요 잘쌌다곸ㅋㅋㅋ 근데 요리같지가 않네옄ㅋㅋ,네 ? 왜요리가 아니죠? 손도 많이가는데ㅋㅋㅋㅋ 겸손하시구나ㅋㅋㅋㅋ,뭐랄까 좀 아쉬운 느낌이에용ㅋㅋㅋ 저도 청소를 별로 안좋아해요,형제자매가 있으신가요?
1899363,MDRW2100047053.1,아 볼륨펌 같은거ㅋ,날씨가 일기 예보랑 다르군 좋네 좋아 ㅋㅋ,아 뒷산 가고싶은데 갑자기 비쏟아질까봐 못가겠다ㅋㅋ,그르게 어플은 세시까지는 비 아니긴한데 믿을수가 있나 ㅋㅋㅋ
614356,감성대화말뭉치.510,남자친구가 결혼하자는데 자기는 돈이 없으니 나 혼자만 대출받아서 집을 사라잖아. 대출도 같이 받아야 하는 거 아니야?,남자친구와 의견이 맞지 않으셨군요.,남자친구한테 대출 같이 받자고 말해봐야겠어요.,남자친구와 잘 해결되시길 바라요.
1311367,MDRW2100011844.1,진짜 ㄹㅇ,다들 축하하는 분위기에 돈도 돌고,식 전에 신부랑 기념사진찍잖아요 무슨 기념품도아니고,신부 지인들 옷차림도 그렇고 맞아요
215259,HuLiC4193,나도 개와 고양이를 키우고 있어. 각각 몇마리씩 키우니?,"나는 개 두 마리, 고양이 한 마리, 앵무새가 있습니다. 당신의 개는 어떤 종인가요?",나의 개는 진돗개라는 한국 토종개야. 사람을 잘 따르고 믿음직해,그것은 훌륭한 개처럼 들립니다. 당신은 어떤 일을 하세요? 전 금융분야에서 일해요.
227155,HuLiC4468,당신은 왜 미국으로 이사했나요?,아니요 나는 미국으로 이사한적이 없어요. 미국은 가본적도 없는걸요?,당신은 어떤 일을 하세요?,나는 지금 학생이에요.
338421,HuLiC7035,재능있는 신진 작가들을 좋아 해. 이름을 다 나열하긴 힘들어.,"맞아요, 이름을 다 외우기는 어려울 수도 있어요. 당신이 가장 좋아하는 작가는 누구입니까?",우리나라 작가로는 김환기 화백을 존경해.,당신은 좋아하는 한국 아티스트가 있나요?
1466460,MDRW2100022650.1,,아무튼 그래서 와 반 분위기 살벌하네싶엇고 사실 짝꿍이랑 첨엔 사이 별로 안좋앗더든요 왜냐면 서로 쪽지질하다가 자꾸 혼나고,그랬다니,좀 서로탓도하다가 마지ㅏㅁㄱ에 앞에 나가면서 허ㅏ해하고 괜히 더 우정돈독해진거임 지금 그래서 친해지고 나니까 반 분위기가 너무 좀 그런거임..
1751193,MDRW2100042795.1,잔치한다 맞네 ㅋ,잔치를 까먹고 있었나ㅋㅋ,ㅋㅋㅋㅋㅋㅋㅋ잠시 까먹고있었네 그래도 점심은 또 점심이니 ㅋ지금 당장 배가 ㅋㅋㅋㅋㅋㅋㅋㅋㅋ,아침을 또 아침 답게 먹어줘야지ㅋㅋㅋ name3언니 신났던데
388520,HuLiC8192,오.. 뭐지??,"칫솔, 치약, 윌슨 같은 친구","칫솔, 치약은 잘 모르겠는데 친구는 좀 필요할 거 같아..",혼자 있으면 외롭잖아
1546542,MDRW2100028064.1,맞아요 싸우는 겜이라 그런가바요 ㅋㅋㅋㅋ 근데 기무타쿠 모델이라는 ㄷㄷ,변호사인데 싸움으로 해결하나요ㅋㅋ 변호사하면 역전재판같은게 생각나는데 진짜 신선하네요ㅋㅋ,오오 역재 재밌는데 변호사출신 깡패라던가 ㅋㅋㅋㅋ 그랬던듯,깡패출신 변호사도 아니고 변호사출신 깡패요? ㅋㅋㅋ
1897463,MDRW2100047052.1,오 발전적인데? ㅋㅋㅋㅋㅋ,근데 결혼생각은 없음.... ㅠㅠ 그게 중요하지 뭐...,나는 지금 남친이 진짜 성격이 쌩반댄데- 서로 너무 다르니까 처음에는 답답하다가 이제 약간 이해하고? 비슷해 지는 느낌이야 그래서 좋을 때도 있고,어떨 때 좋아?
316706,HuLiC6534,아니. 보험판매는 해본적이 없어. 일은 어때? 잘되가?,잘돼 가요. 회사에서 승진한 지 얼마 안 돼서 너무 기대돼요.,와~ 정말 좋겠다!!! 승진했으면 한턱 쏴!!,그럴게요! 너무 신나요. 저는 승진한 지 오래되었습니다.
851106,MDRW2100001381.1,물어봐용,네,지금인증번호 보낸다,683279 일단 물어봤어요 아직 답이 없어
1964434,MDRW2100047258.1,쿠키 어떤거요 머 사거싶나요,저 지금 피라미드게임이랑.........선의의경쟁 그리고 나머지는 포타요 포타로 #가보자고,ㅇㄴ 허 잠깐 포타 네페충전되나요???? 꿀이네,네!!!!!! 포타 어느순간부터 네페되더라고요
639833,MDRW2100000005.49,다른사람한테 나눠주는지... 알수없는,저번에 내가 얻은,일본인들;,30번 주고받아야하는 기프트 이런 거 물어오더라
1530579,MDRW2100026962.1,그래. 마늘빵도사고 못먹은 순두부도 먹고,거기 흑임자 젤라또 맛있더라,ㅎ 이제 맛집을 알아가네~~ 새로운곳도 도전~~~ 가던데만 가지말고,가던데가 실패가 없는법이야
1524402,MDRW2100026560.1,누가 컵 안쓰고 입대고 물마시고있는거임 ??,아니넼,제 실화,ㅋㅋㅋㅋㅋㅋ ㅇㅇㅇㅇ
1529404,MDRW2100026886.1,앚ㅋㅋㅋ 그거은근중요해ㄱㅋ 웃지않을께,저번달생일인친구가 거한걸돌링ㅋ,부담스럽겠다ㅠ 뭐였는데?,버블바스폼ㅋㅋ 그거누르먼ㄱ 거품나오는거ㅋㅋ
431119,HuLiC9175,뭐 그런거도 있고.. 마동석 액션 좋아하는 사람 많잖아?,그치 나도 좋아하는데,근데 너무 소비하는 듯한 느낌?,뭐.. 그래도 물 들어 올 때 노 저어야지
1429837,﻿MDRW2100020110.1,,,오오ㅎㅎ 몰랐네요ㅎ 유튜브도 봐봐야겟어요ㅎㅎ 배달음식은 좋아하세요?,배달음식 좋아해여 ~ 특히 피자!
778568,MDRW2100001145.7,뭐하다 이제 확인?,온줄 몰랐다,게임햇구만,아니거든
129712,HuLiC2218,으깬 감자와 그레이비를 섞어 만든 파이입니다.,그럼 내 취향은 아니겠다. . ㅎㅎ 케이크 먹을 땐 우유를 같이 먹어야지!,"저는 우유를 좋아해요, 특히 케이크에. 좋아하는 디저트가 있나요?",나는 디저트보다는 아이스크림을 더 좋아해 너는?
216004,HuLiC421,맞아 정확하게 알고 있어! 일렉트로닉은 팝음악에 많은 영향을 끼친 장르 중 하나야,저는 EDM에 대해 조금 알아요. 그것은 신디사이저와 전자 악기를 많이 사용하는 전자 음악 장르입니다.,오 많이 알고 있네 보통은 잘 모르던데 너 똑똑하구나,"칭찬해 주셔서 감사합니다, 감사합니다. 저는 제가 똑똑하다고 생각해요. 어떤 종류의 음악을 좋아하시죠?"
997626,MDRW2100001555.1,쿄쿄 영업하는데 재고남은거있나 확인해본다는뎅 아침부터 사람이쫌있는지늦넹 ㅇㅅㅇ,ㅇㅅㅇ.. 귱금띠 없으면 어덯게,자샹 자걍 나 일단 다녀오께 !! 전철타궁 !! 일단 씻궁 애기랑 같이움직이기엔 시간이 넘 마니남아뜌 갔다와서 애기랑 이마트만 가든지 할겡 !! 아님 애기 저녁에퇴근하구 와이퍼사러갈랭? 나이마트가서 장보구 문구나라두 가야되고등 캬캬 바뽀,헐 진짜 바뿌넴 오후에 시간맞음 다녀와도 되구 안되면 저녁에가잠 추유니까 조심히 다녀오규..
420036,HuLiC892,음... 김밥은 날로 먹는 음식은 아니야. 그래서 질문이 적절치 않지만 굳이 말한다면 익혀서 먹는것을 좋아한다고 하겠지?,"저는 젤리곰을 좋아하는데, 생으로 못 먹을 것 같아요.",젤리곰을 생으로? 한번도 생각해본적 없는데? ㅎㅎㅎㅎ,"네, 좋아해요. 너무 맛있어요. 식감이 너무 좋아요."
880131,MDRW2100001398.93,응응,댓글로싸울 분위기더라,헐헐 ㅜㅜ,막
925820,MDRW2100001524.1,ㅋㅋㅋㅋㅋㅋㅋㅋㅋㅋㅋㅋㅋ 부들name1,ㅋㅋ 데헷 쫄았지 너 ㅋㅋㅋ 혼자 먹어 걍 너 인기녀니까 여기저기서 같이 드실래요? 이러면서 다가올걸,ㅋㅋㅋㅋㅋ미춋냐 너 12/30은집걈!?,토익 ㅋvㅋ 근데 왜 그날? 토익 아침일찍보구 점심먹으면대는뎅
1831407,MDRW2100047017.1,레이첼이 웨딩드레스를 입고 카페로 달려들어와,근데 머리가 엄청나게 차랑 차랑,결혼할 남자가 친구랑 자서,헐 시작부터 불륜
1237344,MDRW2100006696.1,그렇죠 어렸을 때부터 운동장 뛰노는 걸 좋아했으니까요,상상이 되는군,대신 공부과목은 별로 였죠,그런거 같아
1842037,MDRW2100047018.1,ㅋㅋㅋㅋㅋㅋㅋㅋㅋㅋㅋ너랑 먹는 얘기 하는 거 넘 재밌어,이렇게 대화 오래한거 진짜 이모든 세상의 사람을 다합쳐도 너밖에 없을거야,정말 난 너밖에 없어,나돈데 어쩜
172996,HuLiC3217,"네, 수영은 할 줄 알지만 잘하지는 못해요. 너는 어때요?",나도 영법은 다 배워서 할 줄은 알지만 장거리를 갈만큼 잘하지는 못해,안됐군요. 당신은 결국 요령을 터득하게 될 거예요. 당신은 다른 어떤 취미들을 가지고 있나요?,취미보단 네가 다니고 있다던 요리학원은 좀 어때?
40391,﻿Chat3462,,,메밀국수 먹고 싶어.,나도 $Theme 좋아하는데.
443806,HuLiC9468,"아, 그러면 이후에 박신혜가 그 집에 이사를 오게되는건가?","그치, 전종서가 그 집에 있을때, 박신혜네 가족이 그집을 사러 한번 구경을 오거든.",와 그럼 백프로 알겠네.,결국 전종서는 어린 박신혜를 알아봐.
1908652,MDRW2100047061.1,씻으라는말을 20번은 해야하나봐,우린 내가 문제이기도해 남편도 8시반에 와서 씻고 9시 저녁먹으니,똑같은말 계속하면 진짜짜증나 근데 그건 어쩔수없지 난 6시애 저녁먹는데도  12시에자니까,애들을 아예 8시전에 잘준비 끝내던지하지 않으면 늦어져
1740600,MDRW2100042023.1,낼아침엔 남은 제육에 김치 쪼사넣고 밥볶아 먹어야디ㅋㅋ,맛있겠군요..,요즘엔 먹는게 낙이다ㅋㅋ,그치 나도 요즘 식욕 좀 올라올때 열심히 먹으련다 ㅋㅋㅋㅋ 먹고싶은거 있을때 잘 먹어야지
644908,MDRW2100000021.128,사지마,내가 먹고싶은디,그래? 사지마,사야겠다 꼭 사야지
1072428,MDRW2100001602.1,,,이거 일기 점점 짧아지는건가여,아.아니
1362430,MDRW2100015339.1,틱인지 알러지인지 알 수가 없으니 원,일단 원인을 모르니 주구장창 안약만 넣을 수도 없고 힘드네..,모니터 화면 볼 때 아예 눈을 안깜빡이더라고,보통 자동으로 깜박이지 않나..
993590,MDRW2100001554.1,아니,검색은 나도 해 샹,찍기엔 비쥬얼이 둥어봐 들어봐 포장을해서 저거랑 딱 반대 비쥬얼이야 왜냐면 포장을해서 이제 프라이팬에 엎잖아? 그럼 저 치즈랑 햄들이 깔려 ㅠ0ㅠ,됐고
961948,MDRW2100001537.1,네엥 ㅎㅎ 자기도 밥 먹었어??,아직은 못먹었엉ㅎㅎ기계청소랑 해놓구 먹으려궁ㅎㅎ 조기먹는데 하루지나서 다 부서져있었겠다ㅜㅜ,아냥 ㅎㅎ 괜찮아 ㅋㅋ 잘먹었었엉 ㅎㅎ 자기도 얼른 기계청소하고 빨리 먹어용,웅웅 알겠어용ㅎㅎ머리는 감겨드렸엉?
131302,HuLiC2255,ㅋㅋㅋ나는 스티븐킹의 유혹하는 글쓰기라는 책을 읽었던 것 같아.,저도 그의 책을 몇 권 읽었어요. 저는 그의 공포와 초자연적인 소설을 좋아합니다.,나도 소설을 쓰고 싶어. 어떤 장르가 좋을까?,어떤 장르를 쓰고 싶으신지는 모르겠지만 스티븐 킹이 역대 베스트셀러 작가로 널리 평가받는다는 건 알고 있습니다.
137007,﻿HuLiC2388,,,김밥 좋아해? 갑자기 김밥이 먹고싶네~,"저 김밥 좋아해요. 너무 맛있어요. 그것은 발효된 생강, 양파, 마늘로 만들어집니다."
49273,Chat5184,머리가 완전 엉망이야.,이런 날에는 무조건 집에 있어야돼.,나도 그러고 싶은데 일이 있어서.,그럼. 빨리 끝내고 들어가.
1732228,MDRW2100041414.1,오 맞아요 오징어 칩 아니고,요즘엔 포카칩 포테이토칩 같은 거 다양한 맛이 많이 나왔어요 육개장 마실 하든가 은근 중독성이 있더라구요 한번 먹으면 손을 뗄 수가 없었어요,오징어집 처음에는 다양한 맛이 많이 나왔는데 별로 먹어보고 싶어,팝콘도 좋아합니다 치즈나 관리 어니언 이런 맛 들어간 팝콘 2호 기본 맛도 짭짤하니 맛이 있긴 하지만 스위트 카라멜 팝콘 폭은 기본 팝콘 보다는 치즈나 갈릭 맛이 좋습니다 맥주랑 먹으면 짱이지요
946366,MDRW2100001530.1,일단 그 소개글부터 읽어봐야겟다 아 나는 4월인줄 알고,],ㅈㄴ 여유부렸는데 ㅅㅂ,ㅋㅋ 4월에 시험본다
1091771,MDRW2100001613.1,언제오?ㆍ 와?,지금 쟈철 앗으니가 6시30분 좀 넘어ㅓㅅ 집 갈거같아,빨리 토익 공부하라노,이거사고싶어 노멀펄슨 두 개 팔고 이거 사면 에반가 ㅋㅋㅋㅋㅋㅋㅋ
1011767,MDRW2100001575.1,낼은 나도 목도리 해야할듯 이번주 강추위 예상한다,오늘 선생님한테 들었는디 영하 13도까지 내려간대 근디 중국 이번에 출장가는 아저씨는 거기가 1월에는 영하 30도까지 떨어진대,헐 영하30도 물 얼겠다,Zzzz겁나 웃기네 중딩 천국 ㅜㅜ
1399506,MDRW2100017966.1,아...ㅜㅠ 그래도 굉장히 아슬아슬하게 다녀오셨네요,맞아요 그래도 직전에 다행히 여행 다녀왔어요 name2은 최근에 어디여행 다녀오셨나요?,전 재작년 말 아부다비요 스페인 꼭 가보려고했는데요 포르투갈하고요,와 저도 두바이랑 아부다비 가보고 싶었는데 재미있으셨겠어요
185667,HuLiC351,정말 친절하시네요! 네가 나아지고 있다니 기뻐요. 성함이 어떻게 되세요?,헐.. 여태까지 내 이름도 모른거야?!,"아뇨, 병원에 입원하기 전까지는 제 진짜 이름을 몰랐어요. 오래 전 일이었어요.",누구세요?
1942637,MDRW2100047098.1,아 ㅋㅋㅋ 물어볼까?,물어볼까 어어 예약했다고,노쇼 없나요? 이렇게?,다오는거 아니잖아요 ㅋㅋㅋㅋㅋㅋㅋㅋㅋㅋ 웃기다..
689698,﻿MDRW2100000104.341,,,아팠니? 난 이제name4괴롭혀야지,ㅋㅋㅋㅋㅋㅋㅋㅋㅋㅋㅋㅋㅋㅋㅋ왜괴롭혀!
934777,MDRW2100001528.1,앗 아니에요! 소규모여도 회식은 회식인데 업무의 연장이니까 핸드폰 잘 못보잖아요ㅠ 진짜 괜찮아요ㅋㅋ 오늘 춥죠~,ㅠㅠ 감사해요 들어가셨어요? 엄청 춥네요!,늦장부리다가 이제 나왔어요 ㅎㅎ 얼른 들어가세요~!,앗 늦게나오셨네요ㅜㅜ 열심히 운동하구 들어가셔요! 저도 들어가구있어요 ㅋㅋ
785612,MDRW2100001157.180,,주위에 이혼녀없나ㅋㅋㅋ,글씨ㅋㄲ,애있어도된단다ㅋㅋ
1626550,MDRW2100033559.1,맞아요 필기할 때 편하더라고요 저는 탭 쓰고 있어요 액정 수리 안 하시고 새로 사실 건가요?,속 lcd가 나갔는대 수리비가 60이래요 ㅋㅋㅋㅋㅋㅋㅋㅋ,꺅 너무하네요 패드 케이스 안 쓰셨나요?,케이스 썼는데 ㅠ 어쩌다 꾹 눌린건지 겉은 멀쩡하고 안만 까매졌어요 저도 참 황당하내요 ㅠ
60627,Chat731,"그래, 연예인들 비디오도 많이 내고 그랬잖어.",나도 요가나 해 볼까?,유연성이 좋나봐?,배우면서 하는 거지 뭐.
202473,HuLiC3899,꾸준히 그리진 않았지만 4년은 하지 않았나 생각해~~,정말 긴 시간이네요. 당신은 다른 취미가 있나요?,다른 취미는 저번에도 말해서 딱히 말할 게 없네 너는 취미가 있니???,저는 비디오 게임 하는 것을 좋아합니다. 당신은요?
1469490,MDRW2100022857.1,오 피자 어느 브랜드 선호하세요? 저도 얼마전에 도미노피자 먹었어요!,지금은 간단하게 냉동제품 먹었는데 파파존스 좋아합니다!,거기 넘 맛있더라구요ㅋㅋㅋ 토마토 소스가 제일 진하다해야할까용,맞아요ㅋㅋ 도미노는 뭐드셨나요?
300459,HuLiC616,"네, 그래요. 저는 새로운 언어를 배우는 것을 좋아합니다. 당신의 새로운 언어는 무엇입니까?","저번에는 일본어 배웠고, 이번에는 프랑스어 배워보려구","너무 멋져요! 저는 항상 다른 언어를 배우고 싶었는데, 어디서부터 시작해야 할지 모르겠어요.",너는 어떤 언어를 공부했어?
105875,HuLiC1669,"그러니까요, 그렇죠? 저는 그들이 다재다능해서 좋아요. 그것들은 매우 다양한 방법으로 요리될 수 있습니다.",난 샌드위치도 계란샌드위치가 제일 좋아!,저는 맛있는 계란 샌드위치를 좋아해요. 저는 치즈 얹는 걸 좋아해요. 어떤 종류의 샌드위치를 좋아하세요?,난 서브웨이에 있는 모든 종류의 샌드위치를 좋아해!
826010,MDRW2100001327.59,아 솔직히 매일은 힘들더라도 3일에 한번은 와야한다고 봅니다,ㅋㅋㅋㅋㅋㅋㅋㅋㅋ 3일에 한번?! 너무 잦은거 아닌지,아앀ㅋㅋㅋㅋㅋ 지성이는 매일보내자나요ㅠ,버블 시스템한달동안 안보내면 환불가능이라니 한 달동안 안보내는 사람도 있냐 설마.. 한 달에 세 번 이하면 환불 이래야하는거 아닐까?
874526,MDRW2100001397.10,괜찮습니다ㅋㅋㅋ덕분에 맛있는 국밥도 먹고 왔는데요! 아! 제가 먹은곳도 직접 운영하시는거 같더라구요. 영수증에 대표자 성함이 : 엄용백 써져있었어요ㅋㅋㅋ,제가 사드려야 덕분인데.. 오 직영점인가봅니다!!,직영점이거나 뭐 친지 가족?등이 서울 올라와서 운영하는거 아닐까 싶어요ㅋㅋㅋㅋ,직영매장이라네용ㅋㅋㅋ
1341511,MDRW2100013941.1,저도 간단하게 샌드위치 먹었어요! 짜장면 저도 먹고싶네요ㅠㅠ 아직 뭐 안드셔서 배고프신가봐요 얼른 식사하셔요ㅠ,사실 늦게 일어나서 별 생각 없긴해요! 어떤 샌드위치 드셨나요ㅜㅠㅠ 맛있겠다ㅠㅠㅠ,햄치즈 먹었어요! ㅠㅠ 그럼 점저로 드시겠네요 저녁엔 뭐 드실건가요? 메뉴,음.. 다이어트하려고 뒷다리살 사논 거 있어서 그거 구워먹을 거예요.. 행복..
1703744,MDRW2100039354.1,흠 .. 뭐가 딱히싫은건아니구 .. 전반적으로 다 .. ㅋㅋㅋㅋㅋㅋㅋ,아 그쵸..ㅋㅋㅋㅋㅋㅋㅋ 저는 청소가 너무 싫어요ㅜㅜㅜㅜ 다싫지만ㅋㅋㅋ,ㅋㅋㅋㅋ맞아요 좋은건 없죠..,주말에 결국 집안일 다는 못했어요ㅋㅋ
135705,HuLiC2357,"아까 설명한 것 같은데? ㅎㅎ 난 주부이자 엄마이자 프리랜스이자, 아주 여러가지 일을 하고 있네. ^^","아, 그래요. 뭘 하고 싶은지 알아서 다행이에요 그게 제일 중요해요.",지금 하고 있는 일이 내 자신을 위한 일이라기 보다는 아이들을 위한 일 대부분이라..,나는 그것을 이해할 수 있어요. 아이들은 돌봐야 할 것들이 많습니다. 몇 개 있어요?
584974,감성대화말뭉치.36146,응. 마치 마비가 된 것처럼 몸도 잘 안 움직여지고 목소리도 안 나와.,긴장을 푸는 데에 좋은 방법이 있을까요?,흥미로운 이야기를 한두 개 준비해서 모임에 나가야겠어.,어색함과 긴장을 깨기 위해 이야기를 준비해 가려고 하시는군요.
1785031,MDRW2100045293.1,ㅋㅋㅋㅋㅋㅋㅋ떡볶이때문에 핫도그를 주문 ㅋㅋㅋㅋㅋ 주객이전도되엇네욬ㅋㅋㅋㅋ,네 그거때문에 최소 주문맞춰서 시킨대요ㅋㅋㅋㅋㅋ,ㅋㅋㅋㅋㅋㅋㅋㅋ전 명랑핫도그 감자통모짜만 그렇게 먹어댓네요 떡볶이맛잇는줄모르고,ㅋㅋㅋ 저도욬ㅋㅋㅋ 자주 시켜드시는 메뉴 있으세요??
333470,HuLiC6921,나는 애완동물을 키우지 않아. 너는 특별히 키우는 애완동물이 있구나?,"아뇨, 없어요 왜 그렇게 말하죠?",수의사가 되고 싶다고 해서 애완동물을 키우고 있어서 그런 장래희망을 가지게 되었나 생각했어.,그거 멋진데요! 여러분은 어떤 종류의 애완동물을 기르고 싶나요? 나는 개와 고양이가 있습니다.
318867,HuLiC6585,제가 가장 좋아하는 음식은 피자예요.,오 피자 좋아하는구나! 나는 포테이토 피자를 가장 좋아해,피자는 제가 가장 좋아하는 음식입니다. 당신은요?,나는 포테이토 토핑 피자를 좋아해. 너는 어떤 토핑을 좋아하니?
1945151,MDRW2100047098.1,아아 애들 추석때 주면 좋긴한디 헐 태극기 그거 내가 name4이 주는거였나 그치 까먹음 ㅎㅎ,ㅋㅋㅋㅋㅋㅋㅋㅋ아 ㅋㅋㅋㅋㅋㅋㅋㅋㅋㅋㅋㅋㅋㅋㅋㅋ 진작 준 줄 알았어 ㅋㅋㅋㅋㅋ애들 두명 해서 3만원 그래도 안넘을까...?,그래도 16000원.. 못넘을듯 그립톡 4개 해서 만원에,ㅋㅋㅋㅋㅋㅋㅋㅋㅋㅋ
1314232,MDRW2100012057.1,ㅋㅋ맞아요 사실 코로나 때문에 더 빨리 개발되는 면도 있는 듯해요,가격 경쟁도 하면서 조금 저렴해지면 더할나위 없을 거 같아요~ㅎㅎ,이왕이면 더 다양하고 저렴하게 ㅋㅋ 그래도 재료 하나하나 사고 버리는 거 생각하면 밀키트들 가격 나쁘진 않은 듯해요 배달보다 싸구 ㅎㅎ,맞아요! 좀 더 다양하게 나오면 좋겠네요
1923539,MDRW2100047076.1,이거 되는 사람이 있긴 한건가... 오늘도 꽝이네,새삼스레 ㅋㅋ 누군간 되겄지 ㅋㅋ,새삼스러웠군.. ㅋ,마음을 비우고 해 ㅋㅋ
648984,MDRW2100000025.35,아 사고 접수 번호 적어서 처리됐나보다,어제 보험사한테 전화하니까 팩스로 그런 거 보냈나봥 내가 따로 적을 건 없드랑,아아 너 허리는 괜춘?,ㅇㅇ 허리는 ㄱㅊ 한의원에서 눌렀을 때도 별 문제없언 걍 시원하다..이런 느낌?
