,dialogue_id,Q-3,Q-2,Q-1,A
1697868,MDRW2100038921.1,,오 다음에 도전해봐야겠어요 두유 비린맛때문에 이상할거같아서 시도를 못해봤거든요,솔직히 우유가 더 맛있긴해요.. 아이스티에 샷추가 해보셨어요?,아니요 저는 거의 있는 메뉴만 먹어서 커스텀하다가 이상한 음료가 제조된적이 있어서ㅋㅋㅋㅋ
503403,감성대화말뭉치.20150,피곤하지만 의욕이 넘쳐서 오늘 하루가 정말 만족스러워.,스스로 공부에 대한 의욕이 넘치는군요.,내일도 열 시간 넘게 공부하려고 해.,내일도 열심히 공부할 수 있기를 바랄게요.
739879,MDRW2100000273.10,name4 재우다 같이 자버림ㅠ,아......맥주는?,"겨우자는중... 30분안으로 깨면 먹이고 마저 재운후에 먹으려구요....,",아..늦어지는구나ㅠㅅㅠ
1254446,MDRW2100007814.1,독거노인댁에 배달하는 건데 할머니가 엄청 기다리시더라고요,완전 보람찼겠네요!,네 조금만 하려고 했는데 몇 년동안 하게 되더라고요 교육봉사는 자격조건이 있나요?,아뇨 저는 그냥 교육봉사가 아니라 과학관 특별전 교육봉사여서 큰 자격조건은 없었어요
1509340,MDRW2100025507.1,으엥,가격은 똑같아,그게 달라? 퀄리티가?,몰랐지
1803375,MDRW2100046629.1,혹시 프리스타일 y..?,헐,헐!,아니!!!
789941,MDRW2100001163.8,고생이 많다 진짜,아직이야더러워,걸스 캔 두 애니띵,ㅡㅡ 이럴때만? 우리가좍도 이제 자가 ㅜㅜ!!!
1888860,MDRW2100047046.1,사셨었는데,맛있어 응응,알 짱커,ㅁㅈㅁㅈ
1314653,MDRW2100012090.1,ㅎㅎ 그살이 다 키로 가길! 얼마나 찐거에요?,name3이 18키로 될락말락이였는데.. 지금 21.4요.ㅋㅋㅋㅋㅋ,오,마이타민 만세
1304685,MDRW2100011334.1,아 그런가요ㅋㅋㅋ 저는 예전에 비타민a 먹었었는데 확실히 눈 뻑뻑한 게 줄은 느낌이었어요,비타민a가 안구건조에 좋나요?,비타민 a가 눈에 좋은데 거기에 루테인도 있었던가? 그래서 눈이 촉촉하게 느껴진 거 같아요,저는 안구건조땜에 오메가먹는건데 영꽝이네요ㅠ 루테인자이잔틴 아이브라이트 같이먹으려구요
207105,HuLiC4004,그 말을 들으니 유감이네요. 기분이 나아지시기를 바래요. 주말에 무슨 계획이 있으세요?,응 나 오랜만에 캠핑 갈거야!,정말 재미있을 것 같네요. 저는 캠핑 가본 적이 없어요. 너 어디가?,바닷가쪽으로 가는데 너도 같이 갈래?
103362,HuLiC1610,"나는 견과류 쿠키, 오레오 쿠키를 좋아해 그럼 스콘도 만들어 봤니?","아니요, 아직 안 해봤지만 해보고 싶어요. 저도 오레오 좋아해요.",오레오는 다 맛있는것 같아 ㅎㅎ 꼭 한번 해봐 스콘 따뜻하게 먹으면 너무 맛있더라,"한 번 먹어봐야겠네요, 추천해 주셔서 감사합니다. 당신은 좋아하는 쿠키 종류가 있나요?"
129857,HuLiC2221,난 심지어 너 이름옆에 하트 이모티콘도 같이 넣었다고!,정말 친절하시네요! 네가 나아지고 있다니 기뻐요. 성함이 어떻게 되세요?,헐.. 여태까지 내 이름도 모른거야?!,"아뇨, 병원에 입원하기 전까지는 제 진짜 이름을 몰랐어요. 오래 전 일이었어요."
1680329,MDRW2100037602.1,그렇더라구요 마음의 여유가 있어야 보이는듯해요,네 여행이 일상에서의 일탈이라는 장점도 분명 있지만 ㅋㅋㅋ 준비하는데서 오는 피로감도 만만치않죠,아 정말요 평소 자기주변을 안둘어보는 걸 모아서 여행으로 발산하는 느낌이에요 둘러 여행이 큰 소비니까 필요이상으로 조장하나 싶기도했어요,그러게요ㅋㅋㅋ 뭔가 사회적으로 강요당한 기분도 있네요
413232,HuLiC8762,"내용은 이제훈님은 건달로 나오는데, 음악을 배우고 싶어서 한석규님에게 찾아가서 알려달라고 하는 내용이에요",건달??,네네 건달이니까 이제 한석규님도 제자로 안받아주져,한석규님은 가수야?
497611,﻿감성대화말뭉치.19020,,,친한 친구가 돈을 빌려달라고 하는데 불황 때문에 장사가 잘 안 되는 바람에 거절해야 해서 슬퍼.,친한 친구에게 돈을 못 빌려주셔서 슬프시군요.
995961,MDRW2100001555.1,담주라고 지금 일하고있다니깐 허얼 .... 허얼 ...,ㅋㅋㅋㅋ 허얼..,나 오늘인줄 알았어 ...허얼.. ㅋㅋㅋㅋㅋㅋㅋㅋㅋㅋㅋ,ㅋㅋㅋㅋㅋ 폭망.. ㅋㅋㅋㅋㅋ
1649907,MDRW2100035309.1,전 최근에 버킷햇 샀어요 ㅎㅎ name1님은요?,우와 버킷햇!!ㅎㅎㅎㅎ 저는 최근에 후드집업을 샀어요! 겨울 준비중입니다.... name2님 사고싶은 물건은 있으신가요?,ㅋㅋ후드집업 좋죠!! 편하고 따뜻하고 ㅎㅎ 저는 요즘 태블릿 사고 싶어요 ㅎㅎ name1님 위시템 있나요?,그쵸 ㅎ.ㅎ 헐 저는 갤플립3입니다... 너무 갖고싶어요...갤플...
839637,MDRW2100001371.1,아니 어제부터 자꾸 name2이 약올리는 그런 분위기가 되네 아니 그래두 맛있는건 name2랑 먹고 싶어서요,ㅋㅋㅋㅋㅋㅋㅋㅋㅋㅋㅋㅋㅋㅋㅋㅋㅋ,헐 회의끝남?,딤섬 얼마나 맛있었니.... 응 끝났어
1110652,MDRW2100001624.1,흐리게 있네ㅋㅋㅋㅋ,이거???,ㅇㅇ,쏠비치 아쿠아월드ㅋㅋ 아까웠대 ㅋㅋㅋ
1670417,﻿MDRW2100036860.1,,,저희 신일 선풍기 샀어요 최근 구매 물건에대해 말하자면,오!! 신일선풍기 첨들어보는데 괜찮나요??
1714615,MDRW2100040130.1,무뚝뚝안짜시던가요!!! ㅋㅋㅋ저깜짝놀랫는데ㅋㅋㅋ 오마침 꼬북칩때리고있었습니다ㅋㄱㅋ,ㅋㅋㅋㅋ 무뚝뚝은 그 맛에 먹는데 후추맛이 나는게 중독성이 있어요 ㅋㅋ,아 후추맛중독성은매우매우인정입니다ㅋㅋㅋㄱ,산책하다 돌아갈때 슈퍼를 가야겠어요ㅋㅋㅋ 무뚝뚝이 먹고싶어졌어요 ㅋㅋ
1242877,MDRW2100007085.1,윽 근데 고수는 좀 아냐 나 사실 방금 베트남 여행 생각했는데 베트남 쌀국수 말고 분짜? 그거 먹을때 향채 다발로 주는 건 좀 어려울듯..,아 고수가 있구나..그래 나도 고수는 좀 그래 그 기억나? 용컹제 썬메리빵집에서 샀던 고로켘ㅋㅋㅋㅋㅋ,ㅋㅋㅋㅋㅋㅋㅋㅋ어 그건 진짜 내 인생 최악의 고로케였다,고수맛고로케ㅋㅋㅋ
401808,HuLiC8499,웅 우리집으로 와,준비하고 갈게!,꼭 공포 아니여도 되는거지?,어 상관없어 뭐 재밌는거 있어?
1929400,MDRW2100047082.1,어디서내놨는지라도 쓰지,내말이,그래서 열받으셨쎄요?,어
1021967,MDRW2100001580.1,나를 갈아넣는 내 분신이라 그런듯,설거지는 죽어도 못 하겠던대ㅋㅋ,ㅠㅠㅠㅋㅋㅋㅋㅋㅋㅋ,그니깡ㅋㅋㅋㅋㅋ
495475,감성대화말뭉치.18598,,딸이 교통사고로 병원에 있다고 해서 달려갔는데 큰 사고가 아니어서 안도했어.,큰 사고가 아니었다니 정말 다행이네요.,그러게 처음에는 너무 놀랐는데 타박상 정도만 입어서 다행이야.
1906044,MDRW2100047059.1,웅,안해줌??1152,내가 놀러가는거로 하자했음,아하 그럼뭐
776169,MDRW2100001121.40,,안이 보통 투명하게 보이거든요ㅋㅋㅋ,ㅋㅋ 맞아요 알려주신 곳,맑게
1263430,MDRW2100008451.1,중고거래해요?,종종요? 특히 이사다닐3ㅐ 많이 하는거같네요,어떤거요?,중고거래요! 맨날 당근마켓 이용해요 ㅋㅋㅋㅋㅋ
352916,HuLiC7370,괜찮아요. 우리는 다음에 만날 수 있습니다.,그날 너무 아파서 응급실에 갔었어.,정말 안타까운 소식이군요. 당신이 빨리 나아지길 바랍니다.,병원갔을때 검사 해놓고 왔는데 어떤 결과가 나올지 너무 걱정돼.
10682,Chat12099,,영화배우 좋아해?,좋아하는 사람도 있구 싫어하는 사람도 있지.,외국 영화배우가 좋아 아님 한국 배우가 좋아?
978348,MDRW2100001543.1,내일 목욕시켜야지 한바퀴돌고왔는데 발만닦아줌,올때....와인 백,ㅇㅋ,미소다 미소
1820817,MDRW2100046966.1,오래됐자나 ㅋ 엄청 뿌듯할듯 ㅎ,글쿠나 엉ㅇ,SKT는 펜싱 한 10년됐을껄? 출전하려면 돈내야되는데 펜싱이 워낙 돈도 많이 들고 지원도 없어서,거러쿤 엉 돈내야해?
1241396,MDRW2100006986.1,싸이월드 세대이신가요? 저는 싸이월드세대예요!,저두여! 그치만 저는 하지는 않았어요,정말요?? 친구들 싸이월드는 구경해보셨나요?,ㅋㅋㅋㅋ 네 일촌 ㅋㅋㅋ
933295,MDRW2100001527.1,네이버가...... 잠만 ´ㅅ`,아 맞당!,맞아.??,웅
460996,감성대화말뭉치.11839,얼마나 힘드시길래요?,마치 넘어진 사람 다시 때리는 거 같아.,상황이 많이 안 좋군요.,처자식을 위해 매일 노력하는데 그래도 너무 힘드네.
1927062,MDRW2100047079.1,그래도 그 소스 비법이 궁금함,약간 키위맛이 많이 나긴 하던데,ㅋㅋ 나 키위먹거나 파인애플 먹으면 맨날 목이 따끔한것같음,키위소스니까 괜찮잖아
426877,HuLiC9077,옹옹ㅜㅜ히스레저의 리즈시절이 나온다고ㅜㅜ,크하하 히스레저 진짜 너무 잘생겼어ㅠㅠ,그리고 그 날것의 느낌이 영화에 그대로 담겨있어서 더 매력적이야ㅜㅜ,맞지맞지 그 터프함이 히스레저랑 찰떡이였어ㅠㅠ
1268205,MDRW2100008791.1,아니요~ 신랑이 매운걸 좋아해서 아이는 소세지 구워주면 그거에 밥 뚝딱,오 저도오늘 비엔나소세지구워요 요즘 뽀로로 얼굴 프린팅된 비엔나가 팔더라구요ㅎ,오~ 애들이 좋아할만한 비엔나!! 요즘에는 식탁에 기름에 굽거나 튀긴음식 없으면 왜 맛있는거 없냐고...,ㅋㅋㅋ 맛을 알아차렸네요ㅋㅋ 기름이 들어가야 맛나쥬ㅋ
1125627,MDRW2100001635.1,ㅋㅋㅋㅋㅋㅋㅅㅍ 적수로구나..! 2차똥마려움이란 것이 폭발햇도다 ㅠㅡㅠ,ㅋㅋㅋ!!역시 응가의 인간화!! 나두 응가를 배출하였도다^.^,응가쌀시간에....! 노는...! 과제하라구....!,ㅠㅡㅠ 힝구힝구.!! 이제 하나 대본 썼네잉!
1465686,MDRW2100022595.1,맞아요 맞아요ㅎㅎ 독서는 그리고 뽑내기용?ㅎ 남자가 여자에게 잘보일때?ㅎㅎ,ㄴㅋㅋㅋㅋㅋㅋㅋㅋㅋㅋㅋㅋㅋㅋㅋㅋㅋㅋㅋㅋ 그런용으로도 쓰일ㄹ수 있군요 지대넓얕 같은 책 보시나요 그럴때는,네네ㅎㅎ 당연히 그렇게 보는거죠ㅎㅎ,하긴ㄴ 말 잘 통하고 지적인 사람은 어디서나 매력있다는 소리를 듣기 마련이죠 요즘 서점 보니까ㅏ 꿈백화점? 이라는 소설책이 핫한거같던데
187003,HuLiC3540,맞아요! 안경 쓰긴 하는데 렌즈 안 껴요. 너는 어때요?,안경 쓰면 시력이 안 좋은 편 아닌가?,"네, 있습니다. 나는 안과에 갈 때 안경을 써야 해요.",나는 예전에 시력이 안 좋았어서 라식 수술을 했어
1148194,MDRW2100001642.1,자진발표 우등생..!,갑시다 우등생의 면모 보여줍시다 !!! 펴닙생의 짬바 보여줍시다!!!! 하 십초남음,똥마려,아 나도 난 시작하기 오분전부터
1368181,MDRW2100015735.1,아버지 폰만 생일선물로 바꿔드렸네요,뭘로 바꿨어요?,플립 진짜 꾸미면 너무 예쁠거같아요 오빠랑 반씩 내서 ㅋㅋ 폴드3요 ㅋㅋ,와;; 더 비싼거 사셨네요?!
130364,HuLiC2233,맞아. 그루트가 제일 귀엽다고 생각해ㅋㅋ,맞아요. 저는 마블 시네마틱 유니버스 전체를 좋아합니다. 당신이 가장 좋아하는 영화는 무엇입니까?,마블 영화중에서는 아이언맨을 가장 재밌게 봤어!,아이언맨은 좋은 사람입니다. 저는 2002년의 첫 아이언맨 영화를 정말 좋아합니다.
1142530,MDRW2100001640.1,나도 무섭긴 하내 ㅋㄷ 점저 다 같이 먹지 싶은데 근데 3일 동안 하고 또 처먹으면 리셋 아니냐?,ㅎㅎㅎ 살찐거 느껴짐 손가락 부음 ㅎㅎㅎ 그니가 갱 우리 적당히 먹고 약속 끝나고 조절 ㄱㄱ하자,ㅇㅋㅇㅋ 동의 완 난 살찌면 바로 느껴지는게 손이랑 ㅅㅂ 턱 시발~~,약속 때 그냥 살 찐 상태로 가자 ㅎㅎ
1091097,MDRW2100001613.1,천천히 나와 ㅋ 나도 준비하고 나갈까?,넵 2분뒤에나가께 웅 ㅋㅋ 나갈까?,ㅇ 나도 나옴 운동? 학교 ?,학교ㅠ
1032001,MDRW2100001585.1,ㅋㅋㅋㅋㅋㅋㅋㅋㅋㅋㅋㅋㅋㅋㅋㅋㅋㅋㅋㅋㅋㅋㅋㅋㅋㅋㅋㅋ,다짜고자 ㅋㅋㅋㅋㅋㅋㅋㅋㅋㅋㅋ,진짜 웃기다 ㅜㅜ,잘알듯 ㅋㅋㅋㅋㅋㅋㅋㅋ
843712,﻿MDRW2100001379.12,,,철도 운전쪽으로 생각하고 있던데,우와
1058084,MDRW2100001596.1,아니 회색이야 난 처음 보는데,헐 쟤 왜케 더러워 유기견인가 목줄은 있는데 흰둥이인가,털이 회색이 아니라 더러운 거겠지?,"응 name4밥, 물, 고양이 사료 고마워 내사랑"
323652,HuLiC6695,그리고 클래식 듣는 걸 좋아해..잘 알려진 베토벤이나 바흐 같은 음악들,당신이 가장 좋아하는 클래식 노래는 무엇입니까?,비발디 사계를 제일 좋아하지..너는?,딱히 좋아하는 건 없어요. 나는 음악이라면 다 좋아해요. 너의 남은 시간에 뭘 하고 싶어요?
1945554,MDRW2100047098.1,저번달인가 호밀가루로 에프에 돌려서 빵만드는거,갑자기 호밀빵은 왜?? 만듷어보려했어??,아 자게에서 보고 콧멍보고 만들었다고 해서 담에 만들어야지 하고 생각만ㅋㅋㅋ,역시 음료군ㅋㅋㅋ 지에스 출첵
1438270,MDRW2100020651.1,완전 여름까진 아니었는데 엄청 더운날이었어요,아 몇 월에 가셨어요?,6월쯤에 갔던것같아요,아 약간 더워질 때네요 여행 많이 다니셨어요?
539928,감성대화말뭉치.27324,맞아. 지금까지 열심히 일해 왔는데 모아둔 돈 하나 없다니.,이를 위해서 뭘 하면 좋을까요?,금전적인 거 말고 한번 내가 할 수 있는 걸 찾아봐야겠어.,금전적인 부분 말고 할 수 있는걸 찾을 생각이군요.
1683057,MDRW2100037806.1,영어 회화 열심히 공부하자...ㅋㅋ 물론 결제한 인강부터 다시 들어야 하는데ㅋㅋㅋ,영어..? 아 증망 하기싫다 그냥 한국에서 살까... ㅎㅎㅎㅎ...,아ㅋㅋㅋㅋ,영어가 너무 싫은걸
584174,감성대화말뭉치.35991,그렇다 보니 퇴직 후에 무엇을 하고 살아야 하나 하고 생각이 많고 일이 손에 안 잡혀.,퇴직 후에 대한 고민이 많으시군요. 어떤 일을 하시면 가장 좋을까요?,아직 정하지 못해 걱정이 많아.,퇴직 후 해야할 일을 정하지 못해 많이 답답하시겠어요.
1745456,MDRW2100042382.1,그런가봐요 긴팔 긴바지 입었는데도 바람이 많이 불어서 너무 춥습니다ㅋㅋㅋ 거기도 비오나요? 여기는 꽤 많이 와요,여기도 비 엄청 많이와요ㅜ저는 백신맞아 다행히 재택이네요~ㅎㅎ 비오는날은 나가기 싫더라구요ㅜ,맞아요 비오는 날은 집에 있는게 제일 좋죠,네~~바지젖는거 정말 싫어하거든요ㅜ 오늘 같은 날은 진짜 감기조심해야겠어요ㅜ
1102190,MDRW2100001620.1,우리는 이집들어올때,씽,5천만원만대출냈자나,부럽다
333363,HuLiC6919,마자. 너무 피곤해. 넌 괜찮아?,나는 너무 피곤해요. 저는 낮잠을 자야 할 것 같아요. 당신이 가장 좋아하는 피자 토핑은 무엇인가요?,난 페페로니 라니깐. 너도 얼릉 자라. 나도 잘테니,"나도 그러고 싶지만, 출근하려면 아침에 일어나야 해요. 취미가 뭐예요?"
1076862,MDRW2100001603.1,"그게 눠임,,,? name2,,,? 오타아니고,,,?","ㅇㅇㅇㅇㅇ, ㅇㅇㅇ,,,, name2ㅇ[ㅔ서 name2 이렇게된건데 나랑 있던 일은 아니고 너가 뭔 일이 있었어서 그거 웃기다고 낳나테 전해준거였다는ㄱ 섯만 기억남","ㅋㅋㅋㅌㅌㅋㅌㅌㅌㅌㅌㅌㅅㅂ 모른다노 ㅋㅋㅋㅋㅋㅋㅋㅋ 기억안나,,,,",ㅋㅋㅋㅋㅋㅋㅋㅋㅋㅋㅋㅋㅋㅋㅋㅋㅋㅋㅋ 왜 기억을 하지 모다노ㅠ 아줜나 짜장면 탕수육 갸땡긴다
1020972,MDRW2100001580.1,아~대봑... 그니까ㅋㅋ 신기하다.....,ㅋㅋㅋㅋㅋㅋㅋㅋ 좋은분 와주시기를 ㅠㅠ,일단 너랑 잘 맞아야...ㅠㅅㅠ,왠만하면 잘 맞을텐데.... 잘 맞..겟됴..? ㅋㅋㅋㅋ 제 생각엔 제가 까다롭지 않다고 생각하는데.. ㅋㅋㅋㅋㅋㅋㅋㅋㅋㅋㅋㅋ 내생각이니까..
902447,MDRW2100001514.1,헐,100프로는 13일까진가? 그렇고,그담에는?,근데 예매수수료는 천원 있잖아 그거 그거는 환불 안됨 ㅋㅋㅋㅋㅋㅋㅋㅋㅋㅋㅋ
712828,MDRW2100000176.21,ㅋㅋ 먹고싶은거있어?,먹고싶은거야많지ㅋㅋ,생각 한번 해봐..,또 물어보니 잘 몰겟당ㅋㅋ 마라탕? 치킨? 막창?
1371227,MDRW2100015943.1,결혼하고 육아하느라 정신없었지,아 나때문이다?,당연하지,엄마가 직장다니는거 상상이 안간다
176190,HuLiC3291,"계란 요리는 만들기 매우 쉽습니다. 계란, 우유, 설탕만 있으면 됩니다.","난 내가 직접 요리하고 싶지는 않고, 그냥 남이 만들어 주는 걸 먹을 거야. ㅎㅎㅎㅎ",계란은 정말 다재다능해요. 그것들은 매우 다양한 방법으로 요리될 수 있습니다.,계란에 인격까지 부여하는 너의 유머 감각이란.. ㅎㅎㅎ 칭찬해.
862611,MDRW2100001383.1,모했니 ㅠㅠ name1,좀잤음,웅 코잤니 잘해ㄸ,응
646025,MDRW2100000021.196,그럼 가운데에 편집이 있어 그거 눌러,편집눌렀어 뭐해빨ㄹㅣ말해,스크롤 내려서 항목 더보기,그다음은
1618408,MDRW2100033022.1,ㅋㅋㅋㅋㅋㅋㅋㅋㅋㅋㅋㅋ나 웨일도 쓰긴해 크롬으로 네이버 들어가구 웨일이 크롬보다 좋긴한데 익숙해져서 쓰는편이야,난 엣지밖에 안 써 웨일 너무 무겁더라,그래? 기능이 많아서 그런가 어쨌든 구글이 이제 수수료 못받는다는건가 그런걸껄 갑질방지법인가 그거,맞아 잘했더라 그건
1900002,MDRW2100047054.1,요즘 제주도가는 비행기표가 많이 저렴해진거같음 전에는 십얼마였던거같은데,맞아 요즈,요새는 십만원도 안되는게,성수기에는되게 비싸구
1822594,MDRW2100046974.1,ㅋㅋㅋㅋㅋㅋㅋㅋㅋㅋ 속수무책ㅋㅋㅋㅋㅋㅋㅋ,현장에서 듣는거랑 다른가 영상으로볼땐 하나도 안들림 걍 계속 툭,ㅋㅋㅋㅋ자꾸 아는척 하신대,탁 이런 소리만 들려
1791905,MDRW2100045775.1,다른 곳에 쓰려고 했는데 결국 먹을것으로 갈듯한 느낌이 드네욬ㅋㅋㅋㅋ 먹을거 얘기를 너무 많이했더니 구매욕이 샘솟아요,ㅋㅋㅌㅋㅋㅋ저도요....제말이요.. 벌키한 사료 쟁여두고싶어요.. 특히 누네띠네 name1님은 먹을 거 산다면 뭐 사고싶으세요?,저도 누네띠네 최고라고 생각해욬ㅋㅋㅋㅋ 나나콘같은것도 좋구요 학생때 매점에서 자주 사먹었는데 그 단맛+매운맛의 밸런스가 아주,맞아요 중독돼요 ㅋㅋㅋㅋㅋ 혹시 그것도 아시나요 그그그 동그란 볼 빵인데 반은 갈색 반은 노란색 설탕 묻어있는거요
1214631,MDRW2100005143.1,^^...ㅠ 아하 약간 오버스럽군여... 자기전에 봐도 괜찮나요?! 자기전에 먹방만 보는데 오늘 도전해봐야겠네요!!,네네 재미있어요!!! 자기전에 봐도 나쁘지 않을 것 같아요,헉 혹시 추천해주실편 있으신가요?,"먹방은 어떤 것 보세요? 저는 요즘 asmr 보는데 엄청나게 단 걸,, 많이 매일들 드시더라고요,, 제 몸도 아닌데 너무 걱정됐어요 다들 건강관리 잘하셔야 할텐데 흠... 잠시만요! 저도 꼬꼬무 아직 시즌1 달리는중이라 다는 못봤지만"
1860389,MDRW2100047026.1,ㅋㅋㅋㅋ 마장동에가면 고기메뉴 많겠구만,"그,, 깡패인가가,, 마장동에서 정육점 사람 건들다가,, 정육점 사람들이 칼 들고 나서서,, 깡패도 마장동은 안 건드린다고 읽은 거 같기도 하고오",흐미 직접 도축하고 손질하면 칼질 잘 하겠다,그롸제 고기 메뉴 많겄구만 ㅋㅋ
1419472,MDRW2100019369.1,매운갈비 만두는 울 엄마도 괜찮다고 하시더라ㅎ,ㅇㅇ근데 달달한거 싫어하는사람은 안맞을듯,저번에 할인?할때 샀던거 같은데 다음에도 할인하면 매운갈비 사야지,ㅇㅇ 그냥 갈비만두보단 훨 나아
1203770,MDRW2100004409.1,별로? 갑자기 호구조사?,그냥 주제가 가족이라는데 난 가정을 꾸리고싶진않아서^^ ㅋㅋㅋ,진로때문에 이것저것 얘기는 하는듯? 돈 벌면 반드시 자취를!,나도 자취하면 근처 친구나 비혼룸메를 꼭 두고싶어
1085401,MDRW2100001611.1,오 조앙~ 난 11시에 밥 먹어야겠옹,조아조앙! 나두 이제 수업 끝나서 조금뒤에 밥먹어야겠따,ㅋㅋㅋㅋㅋ넹~ 아 오늘 너무 나른나른해 난 이제 밥먹을랭!,오옹 딱 들어왔는뎅 밥먹으러 간다했구만~ ㅋㅋㅋㅋㅋㅋㅋㅋㅋㅋㅋㅋㅋㅋㅋㅋㅋ 나두 창문으로 들어오는 햇빛에 녹아가는중이얌.. 11시꺼 출석하구 밥먹어야징~ 맛있게 먹구왕! 목욜에 1교시도 안한댕 11시 수업 하나만 들으면 끝이당 오옹 나두 이제 밥먹어야징
941629,MDRW2100001529.1,고기지 ㅋ,집에 왔는데 다젖었다 완전 고행길이야 조심드가,2차간ㄴ다,아따 아제들 뽜이팅있네
1517138,MDRW2100026047.1,헐 특이한 방식으로 운영 하네요 무언가 장단점이 있겠죠 덕구에서는 주로 어디서 활동하세요,저는 뷰티방이랑 케이돌토크 ㅋㅋㅋ,뷰티 방은 뭐에요,화장품 얘기를 하는 곳이요 ㅋㅋㅋ
1861213,MDRW2100047026.1,예전에 길렀는데 죽었어 ㅋ,포도 같은 . 깐죽인가? 그런 것도,"애플민트, 방울토마마토 등등 깐죽?",또 길러 ㅋㅋ 방울토마토는 우리도 길렀어
719345,MDRW2100000201.91,거기 엿도 팔잖아,시키는 사람이 있으려나 모르겠네 맞아 ㅋㅋㅋ,그니까,옆집 엿장수 아재 맨날있어
792546,MDRW2100001171.37,,빅토르 안...안현수가 떠오르네요,빅토르 안현수??,어어 ㅋㅋㅋ 쇼트트랙... 국가대표 하다가 러시아로 귀화
285895,HuLiC5823,저는 그 게임을 해본 적이 없어요. 무슨일인데요?,100개 넘는 챔피언중 하나를 선택해서 5대5로 팀을 구성해서 서로 전투를 벌이는 게임이야,정말 재미있을 것 같네요. 당신이 가장 좋아하는 챔피언은 누구입니까?,내가 가장 좋아하는 챔피언은 야스오야. 칼을 자유자재로 휘두르는 화려한 챔피언이지
350864,HuLiC7322,지방에있는 사무실인데 규모가 커! 직원수도 많구,사무실에서 일하면서 가장 좋아하는 것은 무엇인가요?,아무래도 퇴근시간과 점심시간이지 ㅋㅋ,그것 참 좋은 생각인 것 같군요. 당신은 점심으로 무엇을 먹을 건가요?
176228,HuLiC3292,지금 하고 있는 일이 내 자신을 위한 일이라기 보다는 아이들을 위한 일 대부분이라..,나는 그것을 이해할 수 있어요. 아이들은 돌봐야 할 것들이 많습니다. 몇 개 있어요?,사람에게 몇 개라고 하면 좀 무례하게 들릴 수 있어. ㅎㅎㅎ,"저는 아직 없지만, 앞으로는 꼭 가졌으면 좋겠어요. 맞아요, 그건 좀 무례할 수 있어요."
1184470,MDRW2100003039.1,ㅋㅋㅋㅋ 어른ㅋㅋㅋㅋ 동아리같은건하셨나요?,당연하죠 ㅋㅋㅋㅋㅋㅋㅋ 뭐했을지 맞춰보세요ㅋㅋ,댄스동아리?,아니요... 조신한 동아리였어요 ㅋㅋ
1916810,MDRW2100047069.1,겁나 친절하드만,새술사가면 나한테 후기물어봄..,그 편의점 술은 다 쓸어가나보네,민트초코나왔을때 나한테물어봐서 솔직히 나민초판데 맛없어서 남겼다 햇는데 담에갔더니 진짜 안팔린다곸ㅋㅋㅋ
118828,HuLiC1968,라섹수술했던 병원으로 가고있어. 근데 좀 멀어 ㅠ,"저런, 안됐군요. 당신에게 모든 일이 잘 되길 바랍니다.",가끔 예약해놓고 가기 귀찮아 질 때도 있어.,그럴 만도 하죠. 당신이 그곳에 가면 그들에게 보상할 계획이 있나요?
31142,﻿Chat1693,,,기분이 좋아.,좋은일있어?
1968476,MDRW2100047562.1,그리고 사먹으려면 또 비싸기도 해요 ㅎ 반찬가게서,그러게요ㅎ 사실 그게 정상인데 자신있는 반찬요리가 있으신가요,자신은 아니고..그냥 애들이 좋아하고 간단해서 하는것들 정도요..ㅋ,애들이 편식을 안하나봐요. 뭐를 잘 먹던가요
1927087,MDRW2100047079.1,내가 말한건 짜조였군 ㅇㅇ,ㅋㅋ 이제 배고프다 점심먹자,ㅇㅇ 점심 고,ㅋㅋ 오냐 또 냉장고 뒤져야겠군
1941708,MDRW2100047098.1,ㅋㅋㅋㅋㅋㅋ이제 침대에 두고 자지 말고 ㅜ 안경쓰고 잠들어서 그런거지?,어어 맞엌ㅋㅋㅋㅋㅋ 이게 알이 커서 안경닦이로,ㅋㅋㅋㅋㅋㅋㅋㅋㅋㅋㅋㅋㅋㅋㅋㅋㅋㅋㅋ 하긴 너꺼 뿔테는 알 작아서,더 닦아야햌ㅋㅋㅋㅋㅋ 어어 맞어 ㅋㅋㅋㅋㅋ
378150,HuLiC7953,오호 빨리 보고싶다,너 원래 반전있는 영화 좋아하잖아,ㅋㅋㅋ맞음 ㅋㅋㅋㅋ 반전 여러개 있으면 더 좋아,ㅋㅋ 영화 예고편 봤어?
577872,감성대화말뭉치.34754,,나와 남편은 서로에게 절대 잔소리를 하지 않아.,서로에게 잔소리를 하지 않는다니 어떤 이유가 있다고 생각하세요?,각자의 일은 알아서 잘 할 거라는 믿음덕분인 것 같아.
1366290,MDRW2100015607.1,,비슷해요...ㅋㅋㅋ,아 그래요?,8만원? 정도 했던 것 같아요
