,dialogue_id,Q-3,Q-2,Q-1,A
1909302,MDRW2100047061.1,어려운데 재미는 있을듯,도전할 의지가 있다는거,마장...,난 주변에서 유망하다고해서 도전할 용기와 의지가 어려워
529002,감성대화말뭉치.25177,친구도 먹고 효과를 봤는데 나를 믿지 않는 눈치야. 왜 그러는지 모르겠어.,지금 상황을 변화시키기 위해 어떤 일을 할 수 있을까요?,전화 통화를 같이해보자고 해야겠어.,전화 통화를 통해서 상황이 잘 해결되기를 바라요.
1542074,MDRW2100027763.1,ㅋㅋ네 좋아요,I wanna play a game 시작할까요?,ㅋㅋㅋㅋ네 시작합시다,답은 두 개입니다 사과가 열 개가 있었습니다 다섯 개의 사과를 먹었다면 남는 사과는 몇개 입니까?
626068,감성대화말뭉치.74,,제대로 된 노후준비도 못 한 채로 은퇴를 하게 생겼어. 앞날이 막막해.,준비하지 못한 채 갑자기 은퇴하게 되어서 아주 속상하시겠어요.,노후준비를 어떻게 해나가야 할까 많은 고민이 필요하겠어.
1808364,MDRW2100046948.1,,프렌즈타임 목표는 우승! 전 국민 생방송 프렌즈타임과 함께해요! 어디가심 ㅋㅋ,쏠비치 ㅋㅋㅋ,진도까지?ㅋㅋ 누구차로
1754265,MDRW2100043010.1,헉 대학원.. 척척석사가 되시는군요 ㅋㅋㅋㅋㅋ 전공이 어떻게되세요?,척척석샄ㅋㅋㅋㅋㅋㅋㅋㅋ 화학이요!,화학! name3님이랑 같은 전공이시군요 멋져요 화학..,name3님 지인분이셨구나 name3님 지인분들이 너무 많아서 누군지 기억이안나욬ㅋㅋㅋㅋㅈㅋ
753339,MDRW2100000537.1,대충한건데요?? 예쁘게 봐주셔서 감사해요,많이 준비하시고요 음식사진들 큰 힘이 되요 멋지세용 음식 잘하시는분이 최고최고예요 ㅎㅎ,언젠가 직접 대접해드리고 싶어요,가족들 진수성찬 매일 차리니 얼마나 좋겠어요
1375522,MDRW2100016259.1,뭐드세요?,전 닭ㄱㅏ슴살이요ㅎㅎ... 드셔보셨나요?,그럼요 식이할때 자주먹었죠,오 어디게 맛있나요?
900003,MDRW2100001514.1,뭐 다 같이 잘수없잖아?,두개하면 우째 자야되는데 ㅋㅋㅋㅋ,우리가족하고 시부모님하고,뭐?
989481,MDRW2100001552.1,모아 2단지 앞,스타벅스 옆이겠네,ㅇㅇ,오빠속옷 확인해봐
983072,MDRW2100001545.1,집에 안와 추운데 어찌 지내는지 필요한거 있으면 얘기해 일요일 사서 갖다줄께 엄마아빠 찬스쓸수있을때 부탁하세요 필요한거 많을듯한데,됐음묘,미니건조대 히터 미니밥상 커피포타 문풍지 ㅇㅇㅇ수고해 다리미 수원 눈 많이 오네 거기도 많이 오지 조심하고 건강챙겨,넴
656419,MDRW2100000057.31,,오늘 우리회사에 새로운 회사 가입한거 목록 보는데 봉쥬르 마트라고 있는거야 그래서 들어가봤는데 망원동에 있는거야 그래서 주소 조회해봤는데 우리 갔던 거기야 봉쥬르 우리회사에서 기장해,헐대박 사장님한테 전화하자,짱이지
703090,﻿MDRW2100000134.31,,,반대로 성인이 되서 연애하는 사람은 20년을 혼자였으니 혼자 살아도 된다고 생각할수도 난 고등학생,아하
582467,감성대화말뭉치.35657,엄마가 자꾸 내가 어제 식탁 위에 있는 만 원을 훔쳐 갔다고 해서 억울해. 나는 정말 가져간 적 없는데.,어머니께 만 원을 가져갔다는 오해를 받아서 정말 억울하고 속상하시겠어요.,맞아. 난 절대로 돈을 가져가지 않았고 가져갈 이유도 없는데 엄마가 내 말을 안 믿어줘.,어머니가 돈을 가져가지 않았다는 말을 믿어주지 않으셔서 난감하시겠어요. 어떻게 하면 어머니께 사실을 알릴 수 있을까요?
1017064,MDRW2100001580.1,오홍 계속 보고싶구 구래요~?,당욘ㅠㅅㅠ,언니 걍막 여기저기 다바르래여 ㅋㅋㅋㅋㅋㅋㅋㅋㅋ,아하 오킹오킹ㅋㅋㅋ
406530,HuLiC8607,우아 신기한데??  그거 어렵다던데,마자마자 어릴 때는 시큼하고 쿰쿰한 어른의 맛이었는데,앙 이제 깨달은 겨?,맞아 이제는 맛을 알고 자기가 해먹는 ㅋㅋㅋㅋㅋ
203421,HuLiC392,정말 잘해주고 맛있는것도 많이줘야겠다 그렇게 훌륭한 일을 하는 친구들이라면,그렇게 해주시니 정말 친절하시네요. 당신은 그들에게 어떤 음식을 주나요?,잘은 모르지만 간식으로 몸에 좋은 것들을 잘 챙겨줘야 하지 않을까?,"그러려고 하지만, 가끔은 어쩔 수 없어요. 간식을 좋아해요."
1159338,MDRW2100001648.1,찍었던거,내야되네,포토샵으로 머이합성함 ㅅㅂ,ㅋㅋㅋㅋㅋㅋㅋㅋㅋㅋㅋㅋㅋㅋㅋㅋㅋㅋㅋㅋㅋㅋㅋㅋㅋㅋ
1417017,MDRW2100019200.1,어떤 면이?,무슨 생각하는지 모르겠어,맞아 뚱한 표정으로,가끔은 우스운 표정을 짓기도 해
265242,HuLiC5347,뭐 사셨어요? 좋은시간 보내셨나요?,이것저것. 식재료랑 케잌등등,케이크 좋아해요. 당신은 어떤 종류의 케이크를 좋아하나요?,비스크 치즈 케이크를 좋아해.^^
207435,HuLiC4011,저는 그런 라면을 먹어본 적이 없어요. 어떻게 생겼나요? 매워요?,매운거 못먹어?,"할 수는 있는데, 너무 매운 건 별로 안 좋아해요. 매운 음식 좋아하세요?",난 매운 음식 엄청 좋아하는 편이야.
928099,MDRW2100001524.1,난 에스알티 안타ㅗㅁ,에스알티 짱빠름 생긴 지 얼마 안되서 깨끗 케이티엑스랑 에스알티 둘 다 타보쟈 ㅎㅎㅎㅎㅎㅎㅎ 너만 가능하면 우리집 취침 죠아 희희 담주월욜 아침기차인데 좌석 별로 없음 ;; 갈거면 예매 얼른 해랑 ?? 에버랜드 사람 많을듯 ㅎㅎㅎ 아니면 한강가서 자전거 타고 치킨이랑 떡볶이 먹기 다 좋아!!!! 너랑 함께라면 !!!! 왜냐면 ㅇㅇ 이야기 듣고싶긩 딸기뷔페 어때? ?? 너 호텔라운지 같은 곳 좋아해? 머랄까 되게 조용하고 서비스 엄청 좋은 곳 (고급호텔) ㅇㅇ 요론고 어때 (너무 사치스러운가) 헿 치즈떡볶이 맛있냥 >< ㅇㅇ 얘기 넘넘 듣구싶어 칠리새우 먹고싶다 갑자기 새우 오동통한거로 아니면 판교에서 힐링...? ... 조용하고 평화?로운곳,여기 혹시 신라호텔이뉘 나 엊그제 가따와땨,이얄 입맛 고급 저기 한남동이래
555146,감성대화말뭉치.30298,간 이식 수술을 받았는데 혼란스러운 일이 생기셨군요. 더 자세하게 말씀해 주시겠어요?,내가 이식받은 간이 내 아들의 간이라니. 수술 전으로 다시 돌아가고 싶어.,아드님의 간을 이식했다는 사실 때문에 충격을 받으셨군요. 어떻게 하면 지금의 충격이 해결될까요?,아들 녀석이 회복상태에 들어가면 물어봐야겠어. 왜 기증을 결심했는지.
316586,HuLiC6531,듣던 중 반가운 말이네요. 당신은 어떤 일을 하세요?,난 카페를 운영한다니까... 너의 개는 어떤 종이야?,제 강아지는 래브라도 리트리버입니다. 당신이 가장 좋아하는 카페 음식은 무엇입니까?,아까 이야기 했는데 자꾸 물어보네? 너 집중 안할래?
1002350,MDRW2100001558.1,몰라 ㅋㅋㅋㅋㅋ 나 탈때 한번 갈앗어,여기 세진점검받고 ? 다른데꺼라하네 ㅋㅋ,예전에 막 탈때 햇을껄? 현경에서,ㅋㅋ찐하밍
183013,HuLiC3449,독서는 제가 가장 좋아하는 취미 중 하나입니다. 당신은 어떤 취미를 가지고 있나요?,나는 취미로 책을 읽고 있지 않지만 일할때 책을 항상 보고 있어,독서는 시간을 보내는 좋은 방법입니다. 당신은 어떤 종류의 책을 읽는 것을 좋아하나요?,나는 주로 소설책을 많이 보고 그걸 분석하고 쓰는 일을 하고 있어
499157,감성대화말뭉치.19319,,우리 딸이 이제 스무 살이 되었는데 웬일로 나와 둘이 여행을 가고 싶다고 하네. 감동이야.,스무 살이 된 딸이 단둘이 여행을 가자고 해서 감동을 받으셨나 봐요.,딸이 사춘기가 되면서 친구들과 놀기만 해서 이런 적이 처음이라 어디를 가야 할지 모르겠어.
642830,MDRW2100000015.3,name4는 근데 원래 유전자가 그랬어 ㅋㅋ 엄마아빠가 좀 컸어 ㅋㅋ 그 이상 찌진않더라 계속 유지 장난감으로 놀아주고싶은데,원래 중대형인가,name3가 독차지해서 애들맨날 못놀아,악순환이군ㅋㅋㅋ
913705,MDRW2100001516.1,놔둬,어느쪽으로 돌리는데,세로,세로가 열려있는거?
409331,HuLiC8672,그래서 조연들 캐스팅도 엄청 신경 쓰셨대,그래서 배우들 연기력이 엄청났구나...,맞아.. 근데 난 이런 영화 보면 좀 무섭더라,뭐가??
1334315,MDRW2100013459.1,피자 먹고싶자아 책임져,먹자먹자 집에오면서 사와 도미노루,머? 도도미오?,ㅋㅋㅋㅋㅋ 옹 너무 비싸서?
1333688,MDRW2100013429.1,안녕하세여,안녕하세요^^ 어제 패럴림픽 개막식 혹시 보셨나요?,아뇨 어제 하는 줄도 몰랐다가 오늘 아침에 탁구 경기 하길래 그건 봤어요,저도 개막식은 못봤어요ㅠㅠ 탁구경기 보셨군요!
1541875,MDRW2100027749.1,ㅋㅋㅋㅋㅋㅋㅋㅋㅋ강아지랑 산책 나갈때마다 퇴마1회씯 당하고,무슨소리야 산책나가고 나서 10분에 한번씩 가루가 됬다가 재구성될듯 심지어 아침에 깨워져서 그아악 하고,ㅋㅋㅋㅋㅋㅋㅋㅋㅋ근데 아침에 깨우는건 멍바멍인듯 우리애는......주말에 늦잠자면 밥달라고 안깨워...그냥 name3이두 늦잠잔다,ㅋㅋㅋㅋ아나 name3이도 같이 늦잠자냑ㅎ 자냐고 간식정도가 아니면 밥보다 잠인거구나... 멋진 강아지다
1789279,MDRW2100045588.1,맞아요.. 맵지만 맛잇죠. 또 먹고싶습니다. 언제든지 가능합니다,전 최근에 불닭을 대량으로 구입했어요,오.. 몇개죠?? 너무 부럽네요,9개요!!
601877,﻿감성대화말뭉치.3946,,,남자친구한테 실망했어.,남자친구의 어떤 모습이 실망스러우셨어요?
731037,MDRW2100000240.26,출석은 다 했나?,귀찮다,왜?,이벤트는 못하겠다 귀찮아서
1557089,MDRW2100028787.1,주간아이돌이었나? 그 프로 말씀하시는거죠 짧은 시간에 모든 걸 보여주고 가기를 원하는... 그런 느낌의 프로였죠,아아 네네! 그 둘이서 뭐 삼촌컨셉이었는지 모르겠는데 암것도 아니구만 애교부려라 어쩌구저쩌구.. 사실 무도의 도니는 좋아하는데 주간아이돌은 별로였어요,아이돌들이 다시 재재를 찾는 이유를 알 거 같아요 ㅎㅎ,저라도 두번세번 찾을것 같아요 ㅎㅎㅎ 놀토에서 활약도 좋았잖아여 ㅋㅋㅋㅋ
764605,MDRW2100001091.209,,저는 저번에 유전자 검사에서 혈행?이 좀 느린?뭐가 있다고해서 오메가3가 좋다는것같아서 챙겨먹어보고있는데,아~~!! 그러시구나~!,네네 분명 도움은 될거에요샘 커큐민은 어디에좋아요?
912044,MDRW2100001516.1,응응~ 쿠팡이 2시 전에 도착한대서 받고 가려고,응 그래영,잘 잤어요?,응
1898028,MDRW2100047053.1,벌써ㅋㅋ,5월에 장마오면 ㅜㅜ,찐득찐득,며칠 비오는것도 이리 싫은데 해를 보고파 ㅋㅋㅋ
496305,﻿감성대화말뭉치.18764,,,오늘 동생이 볼일을 보고 변기 물을 내리지 않았어. 아침부터 정말 기분이 나빠!,동생이 볼일을 본 뒤 뒤처리를 제대로 하지 않아 많이 괴로웠겠군요.
1625648,MDRW2100033494.1,ㅋㅋㅋㅋㅋㅋㅋㅋㅋㅋㅋㅋㅋㅋㅋㅋㅋㅋㅋㅋㅋㅋㅋㅋㅋㅋㅋㅋㅋㅋㅋㅋㅋㅋㅋㅋㅋㅋㅋㅋㅋㅋ,이미...이미 #가보자고,쓰읍..시작됐다 자낳괴의 주절거림 저는요,ㅋㅋㅋㅋㅋㅋㅋㅋㅋㅋㅋㅋㅋㅋㅋㅋㅋㅋㅋㅋㅋ네
1435637,MDRW2100020475.1,그리고 딱히 보람도 없고 그래서 간단한 알바라도 할까 생각중이에요,부업이요?,공공근로요,아 편한가요?
260297,HuLiC5232,저는 일과 학교 때문에 정말 바빴어요.,학업과 일을 병행하고 있는거야? 정말 바쁘겠다!!,"네, 저는 학교와 일 때문에 매우 바쁩니다. 취미가 뭐예요?",내 취미는 식물 기르기야. 너는 취미가 뭐야?
60676,Chat7319,재수하는 친구가 이번에 수능을 치는데 힘들어 죽겠다고 하더라고.,그렇겠지 원래 고3때 공부하는 것 보다 더 힘든 게 재수하는 거라고 하잖아.,하긴 공부하는게 힘든 게 아니라 이번에는 합격해야 한다는 중압감 때문에 그렇겠지.,친구는 점수가 얼마나 올랐다고 해.
1859444,MDRW2100047026.1,15알에 2만원이 넘었던 거같아,아니 난 참외 좋아해서 ㅋㅋ,아항 여름에 좋겠네,흐미.. 간 떨려서 난 못 먹겄네
1704520,MDRW2100039410.1,요즘에는 그릭요거트해서 큰거 팔더라고요! 마트 최고ㅋㅋㅋ,맞아요 사실 시판이 최고에요ㅋㅋㅋㅋ,그냥 일반 요거트는 별론가요?? 전에 보니까 냉동실 넣어서 복숭아 꽝꽝 얼리신 분도 계시던데ㅋㅋㅋㅋ,일반 요거트도 맛있을 것 같긴한데 좀 흘러내릴 것 같긴해요 그릭요거트 대신에 마스카포네 치즈 채우시는 분도 있던데
890377,MDRW2100001499.1,웅웅! 자기 우리 진짜 잘 팔았어!,그래?? 더 내려가구 있어?,웅웅/....,1565네...
257271,HuLiC5162,"아니요, 안 먹어봤어요. 그것은 무엇일까요?",짜파게티랑 너구리 라면을 섞어서 만든 요리야. 약간 매콤한 짜장면 맛 나,"오, 그거 흥미로울 것 같네요. 언제 한번 해봐야겠어요. 당신이 가장 좋아하는 요리는 무엇입니까?",나는 볶음밥 좋아해. 굴소스에다가 계란 당근 야채 적당히 볶아서 만든 거 맛있어
697255,MDRW2100000111.69,ㅋㅋㅋㅋㅋ 할부가 싫어가지구 ㅠㅠ 걍 일시불 근데 아이맥하면,쩐다 능력쟁이 역시,한 3~500만원쯤의 이미진데,네네
351693,HuLiC7341,안타깝게도 펜트하우스는 넷플릭스에 없어 ㅠㅠ 다른 ott 플랫폼을 추천할게,넷플릭스에서 가장 좋은 한국 드라마는 무엇인가요?,넷플릭스 한국 드라마 18어게인 추천할게~,처음 들어보는 이야기네요. 제가 찾아봐야겠어요. 무슨일인데요?
607972,감성대화말뭉치.4065,응. 내가 잘 돌보지 못한 것 같아. 미안해서 눈물이 나네.,아이가 다쳐 슬프시군요.,응. 너무 미안해서 눈물이 나.,주위에 곁에 있어 줄 사람이 있었으면 좋겠네요.
794565,MDRW2100001173.65,바닥딸 쳣다는 ㅋㅋㅋㅋㅋㅋㅋㅋㅋㅋㅋㅋㅋㅋ,남자애가 가족들 모아놓고 한거제,글 보고 기겁ㅋㅋㅋㅋㅋㅋㅋ 엉ㅋㅋㅋㅋ,멘붕올거같음 뭔데 저거/......하면서
1774021,MDRW2100044470.1,헉 엄청 기시네요!,네 그래서 머리감기가 귀찮아요,머리감고 말리는것도 일이겠어요,네 사실 감는거보다 말리는게ㅠㅠ
1833407,MDRW2100047017.1,쌍수 중간에 깨서 사실 수면도아니야,근데 난 첫번째에는,그래도 긴장되고 무섭고 떨려,자고 일어나니 끝나있었어
1292050,MDRW2100010431.1,와!! 꼭 볼게요!!!! 좋아요!!!!!!!! 저는 장르는 추리 좋아하는데 인생영화는 작은아씨들이에요 ㅋㅋㅋㅋ모순...,인생영화 다를순 있죠!! 그렇게 재밌나요? 보려다가 아직 시도 안해봤어요 ..!,전 캐릭터들 성격이 다 다른게 너무 좋았어요! 대사들도 괜찮고요!! 2019년 버전이 더 좋더라고요!,한번 봐야겠어요 ㅎㅎ 저는 인생영화라고 딱 말하기에는 정해진건 없지만 해리포터랑 메이즈러너는 정말 재밌게봤었어요
1490693,MDRW2100024236.1,오히려 짧은게 어색하더라구요,짧은 머리도 하셨어요?,전에 잘랏을때 뭔가 힘을 다 뺏긴 것 같앗어옷,헐 그랬구나ㅜㅜ 짧은머리 본 적 없어서 되게 예쁜 누나 같아요 김경호 가수님 머리 되게 찰랑거리고
161952,HuLiC2963,맞아 주변에서 피자 싫어하는 사람 본적이 없는거 같아,피자는 일반적으로 토마토 소스와 치즈를 얹고 오븐에서 구워진 효스트 플랫브레드로 구성된 전통 이탈리아 요리입니다.,잘 아네! 피자 만들어 본 적 있어?,"아니요, 피자를 만들어 본 적은 없지만 언젠가 꼭 먹어보고 싶어요. 저는 피자가 10세기에 라치오의 남부 이탈리아 마을 가에타에서 라틴어로 쓰인 필사본에 처음 기록되었다는 것을 알고 있습니다."
717045,MDRW2100000196.2,밑에꺼 사진 지워 ㅋㅋ ㅡ개인정보 ㅋㅋ,ㅇㅋ 야..여기.ㅋㅋ,ㅋㅋㅋㅋㅋㅋㅋ,이제 설거지 할란다ㅋㅋ
303971,HuLiC6240,좋은 생각이에요. 어떤 커피를 좋아하세요?,난 아메리카노 좋아해 !,난 그게 뭔지 몰라요. 그것은 무엇일까요?,넌 어떤 커피 좋아해?
886669,MDRW2100001499.1,"주린이 망하는 공식. 처음 시작하며 대형 우량주 들어간다. 하필 고점이라 하락 횡보를 오래한다. 10%이상 떨어지니 못참고 판다. >>>> 이곳저곳 찾아보고, 주변얘기도 듣고 실적주 찾아간다. 하필 조정중.>>>> 몇일을 못참고, 앞으로 급락한다는 안티말에 쫄아 3~4% 떨어지는 날 팔아치운다. >>>> 주변에서 좋은 주식 찾아 장투가 답이란 말듣고 다시 실적주 찾아간다. 운이 좋아서 7~8% 오른다. 그러다가 조정오고 조금 빠질 조짐 보이자, 그나마 이종목에서 4~5% 수익중인거 유지하고 싶어서 후딱 판다. >>>> 이렇게 방황하는 사이 맨처음 들고있던 대형 우량주는 원래 가격 찾아가고, 두번째 들어갔던 실적주는 조정 마치고 급등을 시작한다. >>>>> 몇차례 왔다갔다하면서 거래세도 빠지고 원금은 20% 이상 빠져있다. 본전 복구하고 싶어서 종토방 광고를 ?기 시작한다. 대선주, 진단키트나 백신관련 바이오주, 코인주, 나스닥 상장 관련주들이 돌아가면서 연일 상, 따상 치는 소식 들려온다. 폭락은 안보이고, 폭등만 보인다. 남들은 주식으로 수억씩 버는거 같다. >>>>> 코인주 들어간다. 정부규제강화발표로 떡락한다. 놀래서 -10%때 빼려는데 손이 떨려서 머뭇거리는 사이 -15% 간다. >>>>> 정부발표로 러시아 백신주 들어간다. 장전가가 10%씩 올라서 멈칫거리는 사이 20% 가버린다. 종토방에선 상간다고 난리. 그래서 일단 올라탔다. 15% 마감. 또 -5% 잃었다. >>>>> 종토방에선 월요일은 상간다고 난리가 났다. 일단 월요일 오를거라 믿으며 홀딩. 화이자백신 들어온다는 뉴스가 떴다. 최소 -10% 예상. 처음 시작한 원금은 이제 30~40%밖에 안남았다. 천천히라도 우상향중인 이런 장에선 그냥 대형우량주나(코스피 20위권 이내) 실적 확실한 튼튼한 주식(실적좋은 화학주) 또는 미래가치 확실하고 회사 안정적인 성장주(반도체, 수소, 탄소, 친환경에너지등)에다 묻어두세요. 남이야 하루 30%를 먹건, 40%를 먹건 냅두고요. 아주 실력파 아니면, 나중에 보면 결국 테마주 따라다니는 거의 대부분은 쪽박차고, 이렇게 묻어둔 사람들이 결국 따는게 주식입니다. 그거 지금 주주들이 추적중이야! 자기 내 감이랑 지금까지 경험하고 사람들 분석으로는 8만 5천 밑에서 몇주 주워보는것도 괜찮을것같아 그리고 어제 설치했는데 누가 돈넣었오..",헐..... 누구지? 추적하면 나와??,옹옹!!! 사간 증권사 창구를 보면! 추정 가능하지! 블록딜로 200만주를 받아 간다. 임상 실패라면 받아갈 사람도 없겠죠. 2000억 가까이 되는 돈을 손실을 볼 곧에 투자하지는 않겠죠.  대주주가 욕심을 내고 지금껏 주가를 누르는데 동조해 왔습니다. 그런데 몇일전 일부임상 데이터를 공개하고 또 내부적으로 보았을때에 데이터 질이 좋아서 긴급승인이 될 것으로 예상되니 대주주가 마지막 발악을 한것이 아닌가 하는 생각이 강하게 듬니다. 블록딜 받는 쪽에서도 200만주 대량 물량을 받기가 힘이 들텐대. 이번 블록딜로 운좋게 저가에 매수하는 계기가 될 것이고 대주주도 팔아 놓은 돈으로 대주주 매도 이슈로 주가가 떨어지면 저가에 많은 물량을 다시매수 할수가 있으니 이번 거래는 서로 윈윈하는 거래가 되었을 것입니다. 그동안의 주가 관리를 해온 이유가 있었네요. 대주주 마인드가 씨레기 이긴 합니다. 제물 욕심이 너무 많어. 어째건 서울만 가면 됨니다. 끝까지 가다보면 대박 납니다. 장기투자는 큰 수익나고 단타는 거지된다.,ㅠㅠㅠㅠ 이거 진자냐고 희망회로 아ㅣ냐고 ㅠㅠ... 보이는대로 보면 되는데 숨은 뜻이 있는거처럼 생각하고 있는거 아니냑오....
1040401,MDRW2100001590.1,빠르면 16주부터 느끼는 사람도 있대~나 딱 18주ㅋㅋㅋ 보통 24주?전에 다 느낀다고 하더라궁~완전 신기ㅠㅅㅠ,오오 이시간에 안자고 뭐하는거 ㅠㅠ ㅋㅋㅋㅋㅋㅋㅋㅋㅋㅋㅋ,한시간전에 집에 옴ㅋㅋ,애기말이ㅔ영 ㅋㅋㅋㅋㅋㅋㅋ히히히히히히 엄마 안자니까 애기두 노나봐요
378061,HuLiC7950,넷플로 보면 될듯 ㅎ,웅 우리 어디서 만날래?,흠 우리집은 낼 안되긴 하는데ㅜㅜ,아 진짜? 왜?
747169,﻿MDRW2100000305.4,,,바닷가 근처 예쁜 카페를 많이 알아두었오 빨리 가고싶다,오 ?? 알아봤어 ?? 좋았어
1047378,MDRW2100001593.1,저번에 질문 햇는데 이렇게 생각한댓어 달이 떳다고 전화하지 마시라고요 라고,ㅋㅋㅋㅌㅌㅋ,역시 엠비티아이에서 제일 재밋는건 티와 에프다,가끔 감성에 안젖나
138335,HuLiC2418,손톱이 조금 밋밋한데 네일을 해볼까?,가끔 매니큐어를 받으면 좋을 것 같아요.,너는 네일 받아 본 적 있어?,"네, 몇 번 해봤어요. 가끔 매니큐어를 하는 게 좋아요."
6299,﻿Chat11195,,,나는 눈이 너무 건조해.,병원에는 가 봤니?
853734,MDRW2100001382.1,왜용 ㅠㅠ,스캐니가안돼,사무실 스캔??,ㅇㅇㅇ
460592,감성대화말뭉치.11761,마음이 힘드시군요. 그 부분에 대해 다른 사람들과 대화를 나눠보셨어요?,아직 아무와도 얘기해보진 않았어. 하지만 혼자 있으면 자꾸 눈물이 나.,나는 혼자 있으면 자꾸 눈물이 나는군요.,한 번 용기 내서 주변 사람들에게 말해봐야겠어.
181983,HuLiC3425,러시안 블루도 갖고 싶어요. 그들은 가장 아름다운 고양이 품종 중 하나입니다.,맞아ㅠ너는 애완동물 키우고 있는거 있어?,"네, 개가 한 마리 있어요. 그는 독일 셰퍼드입니다. 당신은요?",개 키우는구나! 나는 거북이 키우고 있어
599566,﻿감성대화말뭉치.3900,,,사후에 내 전 재산을 기부하겠다고 했더니 자식들이 무효 소송을 걸었어.,전 재산 기부라는 결심을 했더니 자식들과 갈등이 생기셨군요.
1441712,MDRW2100020889.1,ㅇㅇ 유튜브 보고 혼자 접었대,ㅎㅎ 취미 생활로 좋네,나 낮잠 자고 있으니까 혼자 접었나봐,이제 다컸네.. 엄마 없어도 스스로 혼자 할 일 찾고
1680954,MDRW2100037650.1,,어제 저녁 먹고 남아있던 반찬들에 계란 후라이와 김치참치 넣어 비벼먹었어요,오 저는 감자삶았어요,오 그렇군요 집에 감자가 많으신가요?
1627186,MDRW2100033607.1,오 누구나오나요? 재밌나요?,라미란씨 나와요 꽤 재밌었어요,라미란씨 나오면 재밌죠오 귱금해요,맞아요 연기 너무 잘하세요
953084,MDRW2100001533.1,재밋것네 빙글빙글 잘 돌고와 웹툰 재밀어 각자의디데이 재밋어,어 그거 봣던거같은데 아 나 그거 조아해 유료분도 여료ㅣㅁ히 보고잇다고 사진이제야 보내지네,오~~~!! 대박 나 처ㅣ신화 보고 눈물흘렷다 ㅜㅜ 오묘 최고 name1이또술먹어 맨날 술만마셔,마자.. 오묘 감정선 최고얌 그치만 이건 음료수라구 알콜 3도
1773602,MDRW2100044438.1,ㅎ ㅏ...육십계 ㅋㅋㅋ한번도 안무봄 맛잇나요,뿌링클 같이 가루쓰 치킨이야 ㅋㅋㅋㅋ 고춧가루 큰덩어리도잇음,아하 강렬한 맛인가보구만,ㅋㅋㅋㅋㅋㅇㅇ마늘맛 매운맛 뿌셔뿌셔불고기맛 단맛
787381,MDRW2100001157.56,그렇게안하것지ㅋ,ㅋㄱㅋㄱㄱㄱ 영맨아는사람이가,응아는사람이래,딴데서 해오면 미안할낀데
112719,HuLiC1827,"네, 좋아해요. 너무 맛있어요. 식감이 너무 좋아요.",쫄깃쫄깃하고 재밌는 식감이기는 해. 하리보를 좋아하는거야?,"한 번도 안 먹어봤어요. 들어본 적은 있지만, 먹어볼 기회가 없었어요.",젤리곰하면 대표적인게 하리보인데 못 먹어봤다니 안타깝다.
1459137,MDRW2100022138.1,오 최근에 어떤드라마 보셨나요? 약간 잔잔한 드라마 좋아해요 고구마가 많지 않은?,저 요즘 막장.. 많이 봤.. 앗.. ㅋㅋㅋ 라켓소년단보셨나요 제가 최근에 본 잔잔하고 힐링되는.. 유일한 드라마가 저거뿐이라,엇 맞아요 ㅋㅋㅋㅋ 라켓소년단 재밌게 봤죠 막장이라하면 펜트하우스 맞나요? ㅎㅎ,보셨구나 어 그것도 있고 임성한 드라마.. 결혼작사작곡이혼이라고..
