,dialogue_id,Q-3,Q-2,Q-1,A
117673,HuLiC1941,지금 대답한대로 서비스업은 미국에서 굉장히 잘 발달되어 있습니다. 특히 미국은 정보 집약적 서비스의 비중이 매년 높아지고 있습니다.,듣던 중 반가운 소리네요. 미국의 서비스 산업은 우리 경제에서 매우 중요한 부분입니다.,맞습니다. 단순히 한 나라의 서비스 산업일 뿐이지만 그것이 다른 나라의 경제에 큰 영향을 주고 받는 것이 재밌지 않나요?,"네, 그것은 경제에 매우 중요합니다. 미국은 세계에서 가장 큰 경제를 가지고 있습니다."
191795,HuLiC3651,거의 일년에 두번정도는 정기검진을 가고 있어.,"좋은 생각이에요, 저도 그렇게 해야겠어요. 당신은 전문가에게 가야 하나요?",라섹수술했던 병원으로 가고있어. 근데 좀 멀어 ㅠ,"저런, 안됐군요. 당신에게 모든 일이 잘 되길 바랍니다."
457472,감성대화말뭉치.11146,오늘 사장님께 칭찬받아서 매우 기뻐.,사장님께 칭찬받으셔서 기분이 좋으시군요.,전 직원 앞에서 내 이름을 부르셨거든. 앞으로도 일을 열심히 해야겠어.,칭찬 덕분에 일에 대한 열정이 더 생기셨군요.
931828,MDRW2100001526.1,ㅇㅇ,지금깐게끝 화장대에 하나잇어 좀다른거 내가세개 삼 딴거살거잇음사,040 백개짜리 세개 산거임?,괜차네 ㄴ 팔십인가 혹시살거없을까바 말해본거임 청구매ㄱㄱ
1046246,MDRW2100001592.1,마지막날에 이렇게 꼬인 실타래가 풀린다 ㅇㅈㄹ! 행님!!! ㅜ-ㅜ,ㅋㅋㅋㅋㅋ ㅜ.ㅡㅜ 모르겠사와요... 저놈이.......... 이렇게 둘이 벌써..감독판 찍는다구?!?!?!,댓글에 키스갈겨 이랬음ㅋㅋㅋㅋㅋㅋㅋㅋㅋㅋㅋㅅㅂ개웃기네,ㅋㅋㅋㅋㅋㅋㅋㅋㅋㅋㅋㅋㅋ
1453537,MDRW2100021756.1,ㅎ... 근데 영국한정은 그냥 그런데 독일 한정이 취저,영국은 색도 밍숭맹숭하군,힝구야 독일 한정은 저렇게 이뿐데..,독일은 간지의 나라인가바 ㅋㅋㅋㅋㅋ
1047098,MDRW2100001593.1,신기하네 좀 더 찾아봐야겟군 30살에,ㅋㅋㅋㅋㅋㅋㅋㅋㅋ,전직하는거아닌가 이러다 진: name2,웃기겠다 화장품회사 다니다가 게임회사 이직
1511092,﻿MDRW2100025628.1,,,영화좋아하세요?,영화관은 자주 안가요
426035,HuLiC9057,아 근데 그거 두번 보고 세번째 보는거 느낌 다 다르다?,아 진짜? 오오 좋타좋타 명작이라는 건가,옹옹 근데 바로 보지는 말구 몇달있다가 봐봐,두세달 정도?
1628449,MDRW2100033700.1,안녕하세요,치킨좋아하세요?,네 치킨 좋아해요,어떤브랜드 좋아하세요?
957386,MDRW2100001537.1,웅웅 곧가용ㅎㅎ,오늘도 수고했어용 ~~조심히와요 도착했어용 ㅎㅎ ~~ 나주로 넘어오니깐 비 마니 온다 ㅠㅠ ~ 안전운전해요,자기두 수업무사히 마치고와용,네에 ~~ 난리치질 않기를 ... ㅋㅋㅋ 나는 끝났어요 ㅎㅎ 납평 가는중
1615867,MDRW2100032853.1,,갤럭시 폴드가 머야 접히는 그거 맞나?,ㅇㅇ 플립은 일반 핸드폰 반접은거,ㅇㅎ 헷갈리네 ㅋㅋㅋㅋ꾸미기 좋아보이던데
1497049,MDRW2100024660.1,응 근데 이게임도 오래되긴 했지 질린다 ㅠ,그래? 그럼 같이 모바일 배틀그라운드 할래?,앗 좋아좋아 다하자,너도 게임 많이 좋아하는구나?
1087736,MDRW2100001612.1,ㅋㅋㅋㅋㅋㅋㅋㅋㅋㅋ저 흔들린 샷 봐ㅋㅋㅋㅋ 뛰어 갔구있구낭..? 난 이제 머리 말려야징,ㅋㅋㅋㅋㅋㅋㅋㅋㅋㅋㅋㅋㅋㅋㅋㅋㅋㅋ 후다닥 들어왔오 ㅎ.ㅎ 조아조앙~ 이제 우리 애기 곧 드라마도 시작하겠당! 샤워하고올겡 쟈깅,웅!!! 샤워하구 와용~ 난 물 마시면서 드라마 기다리는즁,다씻구왔당!! 10시라 드라마 시작했겠넹~ ㅋㅋㅋㅋㅋㅋㅋㅋㅋㅋㅋㅋㅋ
1434704,MDRW2100020408.1,아 맞아요 ㅋㅋ 어린 선수들이 많아서 파리올림픽도 기대해볼만할거같아요 ㅎㅎ,무관중이라서 연습했던 환경대로 하는게 유리했던점도 있대요,아~~~ 그랴서 어린 선수들이 상대적으로 좀 덜 부담감 느꼈을 수 있겠네요! 함성이나 고함 이런게 없으니 ㅎㅎ,네 카더란데 무게있는 의견같아요 사람마다 다르겠죠 ㅎㅎ
737428,MDRW2100000256.23,랜턴ㅋㅋ,랜턴 던킨 거 받았어 프리퀀시 안 쓰면 줘 ㅋㅋ 받게되면 핑크 보냉가방이 더 탐나는데 그게 제일 먼저 끝나겠지,응 ㅋ 언제까지지? 7월이네ㅋ,응 ㅋㅋ 담임하니까 아침에 들르기가 쉽지 않네 퇴근 후에는 가기 싫고ㅎㅎ
237810,HuLiC4713,저는 지금 당장은 아무 것도 하지 않고 있어요. 요즘 일이 너무 바빠서 놀 시간이 없었어요.,그렇구나..그럼 바쁘지 않았을때는 취미가 뭐였어?,저는 책을 많이 읽곤 했어요. 당신은요? 너의 남은 시간에 뭘 하고 싶어요?,난 남는시간에 누워서 빈둥빈둥 하지 ㅋㅋ 특별히 하는 일이 없어.
1187773,MDRW2100003272.1,약간 매운 비빔면?같은건데 계란 얹어주면 맛있더라구요,아아 저 매운거 좋아하는데ㅎㅎ 먹어보고 싶네요 엊그제도 엽떡 젤 매운맛 시켜 먹었어요ㅋㅋ,저는 일반 떡볶이도 매워서 못먹겠던데 대단하시네요,핵불닭소스가 제 최애 소스 입니당ㅋㅋㅋ
1401272,﻿MDRW2100018088.1,,,안녕하세여,안녕하세요
308350,HuLiC6341,이런.. 그럼 고양이는 키우기 힘들겠다,"네, 저도 그렇게 생각하고 있었어요. 애완동물이 있나요?",응응 아까 고양이있다고 했잖아,"네, 저는 두 마리의 고양이가 있어요. 하나는 샴이고 다른 하나는 칼리코입니다."
131676,HuLiC2264,어제 회 많이 먹더니 그게 잘못 된 건가?,"아뇨, 전혀요. 저는 생선회 먹는 것을 좋아합니다. 당신에게 너무 좋아요.",당신은 좀 어때? 나도 몸이 약간 으슬으슬한데 당신은 괜찮아?,"저는 괜찮아요, 물어봐줘서 고마워요. 당신의 몸이 빨리 좋아지길 바랍니다. 나도 생선회 먹는 거 좋아해요."
1324312,MDRW2100012770.1,안녕하세요^^ 최근에 보신 영화 있으신가요,우리들이라는 영화봤어요 name2님은요?,저는 랑종을 봤어요 우리들은 장르가 뭔가요,드라마입니다 랑종 어떠셨어요
1879415,MDRW2100047039.1,근데 나 리빌 안무 볼때 큐가 눈에 들어왔거든 그 털 뿜는 니트 입었을때,오 그거입었구나,근데 걔랑 얘가 같은앤지 못알아봄 아 큐 딱 저정도만 써도 좋겠는데,화장이 달랐나? 그니까..
1523392,MDRW2100026491.1,일 좀 천천히 처리해서 숨 돌려가면서 해...,그러게.. 그냥 좀 오늘 하루 해야 할건 적당히 해야 할듯 싶어.... 눈치도 봐가면서... 넘 빨리 처리하니까 내가 노는줄 아네..,ㅇㅇ 그럴땐 적당히 게으름 좀 피워줘야해,ㅇㅇ.. 그래서 오늘은 적당히 눈치 좀 보고 하려고 출근도 맨날 빨리하는데 오늘은 늦게 들어가겠다...(? 아예 늦은 버스 타고 싶어지는 목요일 오전...
101611,HuLiC1570,"맞아. 기본적으로 장이 약하고, 신경쓰는 일이 생기거나 뭔가 상황이 다르면 탈이 나는것 같기는 해",맞아요. 영양실조와 같은 영양결핍에 대해 걱정할 필요가 없다는 것도 좋은 일입니다.,그건 그래. 텔레비젼에서 가끔 보면 아프리카 아이들 못먹어서 마른 화면을 보면 그래도 먹고 배아픈 내가 나은것 같기는 해,그렇게 보는 것도 좋은 방법이에요. 저는 여러분의 몸을 돌보는 것이 중요하다고 생각합니다.
200643,HuLiC3856,얼마 만에 하시는 거예요? 저는 5살 때부터 놀았어요.,아주 일찍 부터 시작했구나.^^,그게 무슨 말이죠? 5살 때부터 시작했어요.,지금은 어떤 곡을 연주 해?
1332477,MDRW2100013341.1,한번쯤 꼭 가보세용 진짜 예뻐요,하 진짜 코로나 끝나면 꼭 가야겠어요... 그럼 가고싶은 곳은 있으신가요? 그냥 가고싶은 곳!,터키 가보고 싶어요! 음식이 맛있대서요,아 헐 맞아요 터키 음식 맛있다고 하죠ㅠ 전 호주가 너무 가고싶어요...
1024915,MDRW2100001583.1,그거 먹어도 돼?,먹어도 될껄? 몰라 ㅋㅋ,싹난 감자 먹으면 안돼~~,돌려내구 먹음되지 뭐 어차피 키우다 버릴거 같음.
1967693,MDRW2100047505.1,다이어트 넘힘듬,ㅋㅋ 습관이기기 힘듬,배고파ㅜ,미투 약은먹는가
906471,MDRW2100001515.1,아니 그냥 기다리다가 안되면 어쩔 수 없지,실수한건가??,굳이 집착하지마,건게가면 어떻게 ㅋㅋㅋㅋㅋㅋㅋㅋㅋㅋ
1498343,﻿MDRW2100024744.1,,,오늘 홈트 요가하는날인것 같아요 우울해요 먹은건 쉐이크 두잔인데 오늘 요가의날,저도 온라인피트니스 서비스 이용한적있어요 생각보다 홈트 힘들더라구요
1089172,MDRW2100001613.1,아니 니 어떡할라나싶어서 할머니집?,오면 말해줄게 안 오면 아마 그럴듯,ㅇㅋㄷㅋ,나 가방 삿어
1972669,MDRW2100047749.1,존나웃거 제가 시킨다구 햇자나료 ㅎㅎ,아니 이name2 ㅡㅡ;,ㅋㅋㅋㅋㅋㅋㅋㅋㅋㅋㅋㅋㅋㅋㅋㅋㅋㅋㅋㅋㅋㅋㅋㅋㅋㅋㅋㅋㅋㅋㅋㅋㅋㅋㅋㅋㅋㅋㅋㅋㅋㅋㅋㅋㅋㅋㅋㅋㅋㅋㅋㅋㅋㅋㅋㅋㅋㅋㅋㅋㅋㅋㅋㅋㅋ ㅎㅎ,말안했자나 그건 ㅡㅡ
1540594,﻿MDRW2100027663.1,,,저는 어제 스크린골프를 쳤어요. 무슨 운동을 하는지요?,저는 요즘 그룹피티 다녀요 스크린골프는 재밌나요?
433327,HuLiC9225,ㅋㅋㅋㅋ나도,왕석현은 저기서 엄청 유명해졌는데 그뒤로 작품 떠오르는건 없네,그니까 나도 본적 없어,찾아보니 특별출연 이런건 있는데
1128045,MDRW2100001636.1,목안아프니,목?? 미먼 마셔서 목이 아픈가보네 너,나 어제 먼지깨문인지 목 아퍼 뭐여,넘 좋았다궁 그 시간으로 돌아가고 싶어
1792343,MDRW2100045807.1,저 라면 먹을까 고민중이에요 며칠전부터 땡기는데 참았거든요 어떻게 생각하세요,땡기면먹어야죠 라면은 의사가 절대안먹는 음식에 없더라구요 무슨라면좋아하세요?,앜ㅋㅋㅋㅋㅋㅋㅋㅋㅋㅋㅋ 그거 맏는사럼 있나요 ㅋㅋㅋㅋㅋ 다 좋아하는데 안성탕면이 집에 있어요 전 열라면이 먹고 싶어욤,ㅋㅋㅋ곱창이랑 소세지그런거
80170,HuLiC1075,"네, 저는 빵 굽는 것을 좋아해요. 제가 제일 좋아하는 일 중 하나예요.",와... 대단하다.. 난 빵을 구울수 있는 실력도 없지만 그것보다 더 중요한 인내력도 없어서 빵 굽는거는 시도조차 못하겠더라고..,"네, 많은 인내심이 필요해요. 하지만 결국에는 그럴 가치가 있어요.",뭔가 그럴거 같아... 집에 빵굽는 냄세가 나면 진짜 미칠듯이 좋을거 같아... 하..
789756,MDRW2100001163.26,,,너 데려다주고 집에 갔대매 불쌍한 name5이 name2이 데려다주고,ㅡㅡ;;; 가까우니까 왔지
1507201,MDRW2100025360.1,,반려동물은 좋아하세요?,네 저는 고양이를 키우고 있어요 반려동물 좋아하시나요,저는 좋아하는데집에허 털때문에 못키우게하네요 ㅠ
1722099,MDRW2100040668.1,마리오카트 잘 하시나요!?? 저는 맨날 꼴찌해요ㅠ,저도 대부분 하위권이에요ㅠㅠ,ㅠㅠ그래서 동숲같은거 맘편하게 하는편이예요ㅋㅋ,좋아하는 캐릭터가 있으신가요?
1760753,MDRW2100043490.1,맞다 홍광호가 지킬이었어,걔가 지킬이자 하이드였지,노래 진짜 잘했었는데,맞아 나 기립박수 칠뻔
1197474,MDRW2100004001.1,저는 초여름에 김해에 다녀왔어요.,헐 진짜요? 저 거기 사는데 어디 둘러보셨어요?,와인동굴이랑 레일바이크도 탔구요 여러 공원들 둘러보고 왔어요.,김해에 공원 많죠~ 그런데 딱히 맛집은 없는 것 같아요ㅋㅋㅋ
1821249,MDRW2100046966.1,어우 ㅠㅠ 미치긋다 진짬ㅋㅋㅋㅋ,요번에 이모네 둘째이모 삼촌네 많이 화장풉 보냈어 ㅋㅋㅋㅋㅋㅋㅋㅋㅋㅋㅋㅋㅋㅋㅋㅋㅋㅋㅋㅋㅋㅋㅋ 셋재이모도 보ㄴ면 좋아하긴할ㅇ듯,오 ㅎㅎㅎ,근데 택배비가 5천원이야
1266320,MDRW2100008654.1,전 그냥 전부비만 ㅜㅜㅜ 월욜부턴 진짜 도시락 싸다니게요,저도 그러려구요ㅠㅠ 사먹으면 살이 쪄서ㅎㅎ,그리고 돈도나가고 저는 현타도 오더라고요 이돈을 이리 쓰는것이 아니었는데 ㅋㅋ,맞아요 건강에 좋지두 않구..
954622,MDRW2100001534.1,약은 안먹었어?,서서히 먹을게요~,오늘은 링피트를 하는 날입니다 준비되셨나요? 웅웅 밥도먹고,네~ 이따 밥먹고 소화좀 시키고 할거양
936104,MDRW2100001528.1,ㅋㅋㅋㅋㅋ 그래서 우리가 그 오빠를 놀이터로 불러내서 태권도 다니는 친구가 있었는데 걔가 그오빠 뺨때렸어... 나보고도 한대씩 때리라고 했었는데 차마 때리는건 못하겠더라ㅠ ㅋㅋㅋ,ㅠㅠ오래 만났었어??,아냐 ㅋㅋㅋ 중2때니까 진짜 몇달? 오빠 혈액형 머야?,무슨형같아?! ㅋㅋㅋㅋㅋㅋㅋ
733413,MDRW2100000245.96,온라인으로 조사해라 해야지 머,아쉬워하겠군,할 수 었지머 온라인으로 구경해라 해야지,그래 다른곳 가자해
275458,HuLiC5583,,요새 날씨가 오락가락 하네~~,"알아요, 짜증나죠.","응 눈왔다가, 엄청 추웠다가 오늘은 또 따뜻해졌어!"
344037,HuLiC7165,"아니 아직은 그럴 생각은 없어,너는 무슨일을하니?","저는 식료품점에서 계산원으로 일합니다. 싫지만, 돈은 벌어요.","나도 일은 매일하기 싫어ㅜ 하지만, 돈은 벌어야 하니까",그렇게 보는 것도 좋은 방법이에요. 제가 너무 열심히 일하지 않았으면 좋겠어요.
424495,HuLiC9021,비밀은없다 ! 이것도 볼만해,거기에도 이병헌 나오는거야?,아니 이건 이병헌 나오는거 아님,그럼 누구나오는데
462104,감성대화말뭉치.12057,나중에 내가 재정이 안 좋을 땐 누가 나를 챙겨줄지 모르겠네.,마음이 안 좋으시겠어요. 어떻게 하면 지금의 상황을 변화시킬 수 있을까요?,아들에게 솔직하게 얘기해 봐야겠어.,자신감을 갖고 아들에게 솔직하게 얘기해 보려 하시는군요.
1631875,MDRW2100033950.1,ㅋㅋㅋ저딴거먹었답니다,아 ....... 실망.... 다른거 드시다니... 부찌 대리만족할라 했는데,갑자기 돈쫄먹고싶어서요ㅋㅋㅋㅋ,돈쫄 맛있었겠네여ㅋ
1886796,MDRW2100047045.1,온콘은 쓰렉~,서버가 안 좋아서 그런거야,온콘은 노래도 안하고~ 지들 얘기만 ㅋㅋ,그건 기획이 안 좋아서 그런거고
1569170,MDRW2100029632.1,그래도 완성되서 굴러가는거 보면 재밌어요,그쵸ㅎㅎ 뿌듯한 마음이,어떤 언어 하셨어요?,파이썬이요ㅎㅎ 제일 쉽다던데 벽을 느끼고 돌아섰어요ㅋㅋ
1076247,MDRW2100001603.1,그래 엉엉이다 믜친넘아ㅠ,이벰 뱨가,저게 뭐야,째가 아닌데
549854,감성대화말뭉치.29264,,오늘 결혼 약속을 한 여자친구네 집에 갔어.,여자 친구와 결혼 약속을 하셨군요.,응. 행복한데 아직 부모님의 허락을 못 받았어.
1421155,MDRW2100019486.1,네 ㅎㅎㅎ막 문화유산 답사 같이 가니까 고등학생이 된 기분이었어요,ㅋㅋㅋ 현장학습 같았나봐요 어디 갔었어요?,경복궁을 갔었어요 ㅎㅎㅎㅎ,아 저 궁투어 좋아해요
345813,﻿HuLiC7206,,,무슨 일 있어? 왜 이렇게 연락을 안 받아,"죄송해요, 전화 못 봤어요. 그것은 무엇에 관한 것이었나요?"
514696,﻿감성대화말뭉치.22379,,,선생님이 추천해주신 진로는 믿을만한 것 같아.,선생님의 진로 추천이 마음에 드시나보죠?
899531,MDRW2100001504.1,오늘 교촌 허니콤보 먹을건데 뭐 하나 더 시킬거 추천받음 양이 애매해서,오 응떡??,아니면 그냥 편의점 떡볶이나 사서 돌려먹을까 두개 시키면 남을듯,그것도괜찮ㅎ
427048,HuLiC9080,와..ㅋㅋㅋㅋ너무 피해망상이다,옹옹 그리고 또 어떤 이쁜 여자가 좀 좋은 기회를 얻게 되면 그게 다 외적으로 예뻐서 라고 생각해,ㅋㅋㅋㅋㅋ너무 피곤한 스타일이다,ㅋㅋㅋ그런데 이 여자가 어느 날 헬스장을 등록하게 되
1479763,MDRW2100023518.1,맞아요!!!!!ㅋㅋㅋㅋㅋㅋㅋㅋㅋㅋㅋㅋㅋㅋ 또 보시는 예능 클립 있으신가요?!?!?,유퀴즈온더블럭은 알고리즘에 뜨면 가끔 봐요!!,"아하,,, 그럼 놀면 뭐하니는 안보세요?!","아직 그게 무슨 이야기를 하는지 모르겠어요 ㅋㄱㄱㄱㄱ큐ㅜㅜㅠ 친구랑 정준하 나온거 봤었는데 이게 이렇게 매번 꽁트를 하는건지 그 라붐 노래 부른거도 이 프로라고하고 이렇게,,.뒤쳐집니다,,.,.!!!!^^!!!!!!"
997046,MDRW2100001555.1,우리자기 이번주 힘내자!! 길 미끄러우님가 안전운전하구 사랑해,일찍갔엉? 사랑해에,웅웅 다하구 컴퓨터에 정리하려공!,name36 번호판 정면사진이랑 계기판사진좀 부탁해여~
50123,Chat5339,그 얘긴 어딜가나 듣는다.,자꾸 들어도 안좋을건 없지.,건강을 생각하니 그렇지?,그럼. 잘 챙겨 다니라고.
865702,MDRW2100001388.101,요기요 치킨2처넌나왓다 롯데리아하면 14천원에 8처넌할인구만,ㅋㅋ오늘은 엄마 손을 측정해보겠다 롯데리아도 치킨 쿠폰 쓸 수 있는겨?!!ㅋㅋㅋ,웅!! 치킨카테고리에잇다구!!!,ㅋㅋㅋ오호 그래도 짬뽕 먹는게 낫겠디?ㅋㅋㅋㅋ
1488807,MDRW2100024117.1,,반려동물 키우시나요?,강아지를 한마리 키우고있습니다 name1은요? 제가 키우는 강아지는 나이가 많습니다. 무려 15살이에요 별명이 늙은애기입니다,신사라는 이름이 잘 어울릴것만 같군요
167568,HuLiC3092,나는 남는 시간에 그냥 사색을 즐겨.,그것은 멋지네요. 여가 시간에 어떤 취미 활동을 좋아하시나요?,"멍때리거나, 책은 아주 가끔 읽어. 아! 만화책 보는거 좋아해.",만화책은 멋집니다. 저는 슈퍼히어로 만화를 좋아해요. 좋아하는 거 있어요?
717869,MDRW2100000200.50,오케오케,굿~,굳~~~,거율 개드러워
217913,HuLiC4254,애들이랑 같이 키즈카페에 자주 가더라 ㅋㅋ,"네, 아이들과 놀기에 아주 좋은 곳이에요. 당신은요? 아이가 있으세요?",아니 나는 조카밖에 없어 ㅋㅋㅋ 너는 애기가 있어?,"아니요, 저는 아이가 없어요. 그래도 언젠가는 아이를 갖고 싶어요."
1203025,MDRW2100004366.1,머머 안봤는디,나 조금씩 다 보긴했는디 끝까지 다 본게 얼마 없어,아 그게 다 초반이 쪼까 지루해서 그런게잇지 뒤로갈수록 멈출수없어,그치그치 재미진디 내 집중력이 따라가질 못해야
626905,감성대화말뭉치.7564,요새 너무 혼란스러워.,혼란스러운 일이 있으신가요?,아들이 사춘기가 왔는지 나를 피하는것 같아.,아들이 피해서 혼란스러우시군요.
821552,MDRW2100001303.1,스며들다는 표현은 머야?,엥 스며들다 안써? 아 이거 살짝 아이돌판 용어인가 아이돌 이름이 재민이다 예를들어 그러면 잼며들엇다 이러던데 윤며들다도 잇네 저런느낌,아 트위치에서 쓰는거 가끔 본거같은데 좀 마이너 한듯,애초에 스며들 대상이 덕질할 대상이니까 아이돌 유튭 댓글에 개많지않남 아냐 name1야 세대 차이아닐까..
1568061,MDRW2100029556.1,네ㅋㅋ 근데 영화가 더 잘 살린듯,그러게요 ㅎㅎ 눈물 한방울 훔쳤다는,눈물이 많으시군요!,마자요ㅜㅋㅋ 별거 아닌거 봐도 슬프더라구요
1733619,MDRW2100041514.1,헐 근데 지금 비가 와서 완전 쌀국수각이에요,어 지금 비오나요??? 설마 제 미각이 비올걸 예상한걸까요 ㅋㅋㅋㅋㅋㅋ쌀국수각인걸 미리 알았던걸까요!!,ㅋㅋㅋㅋㅋㅋ그런가봐요~!~! 아니 저 저녁까지 식단 열심히해두고 호르몬 몬이기고 과자조졋슴다..,ㅋㅋㅋㅋㅋ 아이구.. 무슨 과자드셨어요 저는 촉촉한
760371,MDRW2100000994.1,요즘 다힘든거 같아요 영화도 보러가면 자리도 많이 비었더라구요,최근에 어떤영화 보셨나요?,일욜에 모가디슈봤는데 잼나요,반응 좋더라구요. 신파없이 잘 만들었다고
622811,감성대화말뭉치.6753,같이 살던 친구가 몰래 방을 내놓고 보증금을 가지고 잠수 탔어. 잡을 수 있을까 불안해.,친구가 보증금을 가지고 잠수를 타셨군요. 갑작스러워 혼란스러우시겠어요.,이대로 돌아오지 않을 거 같은데 경찰에 신고할까 고민 중이야.,경찰에 신고하려고 고민 중이시군요. 어떻게 하는 것이 가장 좋을까요?
1649469,MDRW2100035277.1,굶지 않구 먹어야 살죠,ㅎㅎ점심 먹고 왔어요~,전 집에서 조미김에 맛 살 단무지를 만 꼬마김밥 먹었어요 ㅋㅋㅋ name2님은 뭘 드셨나요?,죽이요~:) 간단하게 먹으니 좋네요ㅋㅋㅋ
1382874,MDRW2100016774.1,저는 추리소설 좋아해요! 결말이 눈에 딱 보이는걸 좋아해서 범인 떡밥 딱딱 나오는게 좋더라구요,저는 떡밥을 잘 못 찾아가는데 name2님은 추리력이 좋으신가봐여...!,추리력이라기보단 그냥 읽다보면 술술술 풀려나가는게 재밌더라구요!!,혹시 추천해주실 작품이 있으실까요? 듣다 보니 관심이 생기네요!
1337302,MDRW2100013652.1,그정도로 떨어질거면 원래 죽은 꽃일꺼에요~~,그래요?? 전 쫄았네요 정말 박사시네요 8년 내공 인정입니다 ㅎㅎ 요걸 키워서 토마토 사진 찍을수 있을지 ㅋㅋ 가을에도 열매나요 지금은 가망이 없는데,네 가을까지도 가능해요? !,오 그래요 여름만 나나 했어요 파는 잘자라요?
386808,HuLiC8152,ㅋㅋㅋ진심 딥빡이었지,빨리 다른 영화들 개봉했으면 좋겠다,ㅇㅇ런칭고 빨리 됐으면,ㅋㅋㅋㅋㅋ한참 멀었을듯
672732,MDRW2100000090.57,오동통하고 약간 붉은끼잇는? 그런게 이쁘더라 난,마져 우리남편이약간그런입술이라 이뻐,넌 잘만났네 ㅋㅋ,언니니ㅏㄴ 고양이상이좋?아 강아지상이좋?아
622051,﻿감성대화말뭉치.6605,,,고혈압에 걸려서 내가 좋아하던 헬스를 못 하게 되어서 너무 답답하고 슬퍼.,고혈압 때문에 많이 답답하고 슬프시겠어요.
744395,MDRW2100000290.8,쓰레기걸 말도 구독한 사람도 있긴있는데 겜방하는 사람들이라,아,니한테는 별로? 재미없을수도,나 겜장은 또 안봐서ㅎ ㅎㅎ
1475664,MDRW2100023251.1,직업에대해ㅎㅎ 근데 스카웃됫다고 하셨잖아요ㅎ,네넵 ~,얼마나 잘해서 그런거에요? 가늠이안가서ㅎ 판매1등이라는게ㅎ 그게 쉬운건아니잖아요ㅎ,판매를 1등이라기보단 창단 멤버라고 해야할까요
63436,Chat7879,후드티를 하나 살까?,가을이니 딱 좋을거 같기도 하구.,그래 후드티로 결정했어.,이쁜$Theme으로 사.
744234,MDRW2100000290.10,ㅎ...,이제,나는 일하면서는 거의 책 보는 듯?,순수 흥미로 봐야됨
397149,HuLiC8391,오 있어 !! 넷플에 있다 ㅎㅎ,오예 ㅋㅋ 바로 봐야지,ㅋㅋㅋㅋ넷플 구독해놓으니까 좋긴하네,그니깐 말이야
286939,HuLiC5848,응 나는 가 본 적이 있어 일본어를 잘하는데 일본에 한번도 가 본 적이 없니?,"아니요, 아직 안 했어요. 언젠가 꼭 가고 싶어요. 다른 언어는 할 줄 아세요?",그렇구나! 코로나라 일본에 못 가지만 ㅠㅠ 시간이 지나면 갈 수 있을거야.. 나는 개발을 하려면 영어가 필수여서 영어를 좀 할 줄 알아,그거 멋진데요! 저는 일본어를 배우고 싶은데 어디서부터 시작해야 할지 모르겠어요.
1414367,MDRW2100019008.1,나는 오늘 방청소도 하고~ 어젠 설거지했고~오늘은 음쓰 버려야해 ~~,난 오늘 방청소했어!! 확실히 엄마있으면 내가 덜 해ㅠㅠ,설거지 40분하고 엄마가 카드줘서 마라탕 사먹음 ㅋㅎ,너희 집은 집안일에 대한 보상이 확실하구나! 우리집도 좀 더 나눠야할것같아
1338507,MDRW2100013734.1,이번에 무슨맛이야?,찰떡? 그런 떡이 포함된거였어,오 맛있겠다 이번달엔 베스킨라빈스를 못갔거든,민트초코도 맛있지않아.
730886,MDRW2100000240.16,나두,바닷가 있지,놀곳 많지,ㅋㅋ그래
53737,Chat600,진짜 아무 생각 없이 한다는 거야?,생각이야 하지. 운동을 어떻게 하면 더 효과적일까?,모 일상적인 고민들이나 이런 생각은 전혀 하지 않나 보네.,어. 나는 그 순간만 생각해. 운동할 때는. 그래서 운동을 좋아해.
1518507,MDRW2100026142.1,사실 난 인간불신에 가까워서 더 그런것 같아,ㅋㅋㅋㅋㅋㅋㅋ그런 ㅠㅠ,화면 뒷사람 의심하기 해,온라인 커뮤니티에서는 괜찮은 거같아
1462538,MDRW2100022373.1,,안녕하세요 반갑습니다,안녕하세요,점심은 먹었나요?
667439,MDRW2100000082.55,업비트 머잇어?,12시선착인데,없지 ㅋㅋ 무배라 해도 ㅋㅋ,뭔말인짘 선착이래 좀따연구해봐야지
1347263,MDRW2100014334.1,오랜만이에요! 식사하셨어요???,네 좀전에 먹었어요!,오오! 어떤 맛있는걸 드셨나요??,오늘 마라탕이랑 꿔바로우 먹었어요!
